Statement,Link,Date
‘Pinas pugad ng mga crypto scammer – Hontiveros,https://www.abante.com.ph/2023/04/19/pinas-pugad-ng-mga-crypto-scammer-hontiveros/,
PBBM gigisahin Chinese envoy sa banta vs mga OFW,https://www.abante.com.ph/2023/04/19/pbbm-gigisahin-chinese-envoy-sa-banta-vs-mga-ofw/,
Isko susulutin si Artes sa MMDA,https://www.abante.com.ph/2023/04/19/isko-susulutin-si-artes-sa-mmda/,
"Team Imee, Irene bakbakan sa Cabinet post Minguita, Doc Willie agawan sa DOH",https://www.abante.com.ph/2023/04/19/team-imee-irene-bakbakan-sa-cabinet-post-minguita-doc-willie-agawan-sa-doh/,
"Tugboat lumubog, 4 pahinante nasagip",https://www.abante.com.ph/2023/04/19/tugboat-lumubog-4-pahinante-nasagip/,
"Villar inaway mga sikyo sa BF Resort ‘Ano ‘yan bakla, sasaktan ko?’",https://www.abante.com.ph/2023/04/19/villar-inaway-mga-sikyo-sa-bf-resort-ano-yan-bakla-sasaktan-ko/,
Kawatan ng Shopee delivery kinalawit,https://www.abante.com.ph/2023/04/19/kawatan-ng-shopee-delivery-kinalawit/,
65-anyos mamshie pasado sa Bar exam,https://www.abante.com.ph/2023/04/19/65-anyos-mamshie-pasado-sa-bar-exam-2/,
Colonel pinalagan paratang na bagman ni Teves,https://www.abante.com.ph/2023/04/19/colonel-pinalagan-paratang-na-bagman-ni-teves/,
Devin Booker sinindihan opensa ng Suns sa Game 2,https://www.abante.com.ph/2023/04/19/devin-booker-sinindihan-opensa-ng-suns-sa-game-2/,
"CJ Perez, Gilas pukpukan ensayo para bawiin ginto sa SEA Games",https://www.abante.com.ph/2023/04/19/cj-perez-gilas-pukpukan-ensayo-para-bawiin-ginto-sa-sea-games/,
Mga celebrity hilig mobile game,https://www.abante.com.ph/2023/04/19/mga-celebrity-hilig-mobile-game/,
Shooter Amparo Acuña puputok sa Asian Games,https://www.abante.com.ph/2023/04/19/shooter-amparo-acuna-puputok-sa-asian-games/,
"Barbie, David series pinarangalan sa New York",https://www.abante.com.ph/2023/04/19/0barbie-david-series-pinarangalan-sa-new-york/,
"Maja, Vic magsasama sa sitcom",https://www.abante.com.ph/2023/04/19/maja-vic-magsasama-sa-sitcom/,
"Mga diamond ni Karla, nakakalula",https://www.abante.com.ph/2023/04/19/mga-diamond-ni-karla-nakakalula/,
"Derek, Ellen magta-try magka-baby",https://www.abante.com.ph/2023/04/19/derek-ellen-magta-try-magka-baby/,
"Chennie Tagaod, FEU humihinga pa sa semis",https://www.abante.com.ph/2023/04/19/chennie-tagaod-feu-humihinga-pa-sa-semis/,
ABAP chief Ed Picson sumakabilang-buhay na,https://www.abante.com.ph/2023/04/19/abap-chief-ed-picson-sumakabilang-buhay-na/,
Draymond Green ban ng 1 laro dahil sa pananapak sa dibdib,https://www.abante.com.ph/2023/04/19/draymond-green-ban-ng-1-laro-dahil-sa-pananapak-sa-dibdib/,
Poy Erram apektado sa pambabastos ng fan,https://www.abante.com.ph/2023/04/19/poy-erram-apektado-sa-pambabastos-ng-fan/,
Wala pa talagang TV network: Boss Vic sinabi kay Willie ang options,https://www.abante.com.ph/2023/04/19/wala-pa-talagang-tv-network-boss-vic-sinabi-kay-willie-ang-options/,
Leo Isaac napiling PSL Commissioner,https://www.abante.com.ph/2023/04/19/leo-isaac-napiling-psl-commissioner/,
"Hindi pa rin tanggap pagkamatay ni Andrei: Josh uuwi muna sa UK, may trauma pa",https://www.abante.com.ph/2023/04/19/hindi-pa-rin-tanggap-pagkamatay-ni-andrei-josh-uuwi-muna-sa-uk-may-trauma-pa/,
E-Palarong Pambansa babaguhin mga kabataan,https://www.abante.com.ph/2023/04/19/e-palarong-pambansa-babaguhin-mga-kabataan1/,
National team libero Bang Pineda gamay si coach Jorge Souza de Brito,https://www.abante.com.ph/2023/04/19/national-team-libero-bang-pineda-gamay-si-coach-jorge-souza-de-brito/,
Jayson Tatum binitbit Celtics sa Game 2 kontra Hawks,https://www.abante.com.ph/2023/04/19/jayson-tatum-binitbit-celtics-sa-game-2-kontra-hawks/,
GAB Chairman Richard Clarin pupuksain Dayaan sa boksing,https://www.abante.com.ph/2023/04/19/gab-chairman-richard-clarin-pupuksain-dayaan-sa-boksing/,
Miranda atat sa romansa ni JM,https://www.abante.com.ph/2023/04/19/miranda-atat-sa-romansa-ni-jm/,
"Dedma kina Marvin, Baron: Bea tinuhog sina John Lloyd, Jericho",https://www.abante.com.ph/2023/04/19/dedma-kina-marvin-baron-bea-tinuhog-sina-john-lloyd-jericho/,
In love uli? Carla mas gumanda nang mawala si Tom,https://www.abante.com.ph/2023/04/19/in-love-uli-carla-mas-gumanda-nang-mawala-si-tom/,
Baby sa Quezon isinilang may ari ng babae at lalaki,https://www.abante.com.ph/2023/04/19/baby-sa-quezon-isinilang-may-ari-ng-babae-at-lalaki/,
Johann Chua buhay pa sa Olongapo 10-Ball,https://www.abante.com.ph/2023/04/19/johann-chua-buhay-pa-sa-olongapo-10-ball/,
DLSU hakot award sa New York conference,https://www.abante.com.ph/2023/04/19/dlsu-hakot-award-sa-new-york-conference/,
"All Too Easy, Ipolitika pakners sa karerahan",https://www.abante.com.ph/2023/04/19/all-too-easy-ipolitika-pakners-sa-karerahan/,
60-anyos Tiktoker lodi sa kaseksihan,https://www.abante.com.ph/2023/04/19/60-anyos-tiktoker-lodi-sa-kaseksihan/,
"Shohei Ohtani, Los Angeles Angels pinahiya New York Yankees sa balwarte",https://www.abante.com.ph/2023/04/19/shohei-ohtani-los-angeles-angels-pinahiya-new-york-yankees-sa-balwarte/,
"Kelot nagpalusot sa ospital, ‘tinubuan’ ng pipino",https://www.abante.com.ph/2023/04/19/kelot-nagpalusot-sa-ospital-tinubuan-ng-pipino/,
Legends 18U dribol sa PABL,https://www.abante.com.ph/2023/04/19/legends-18u-dribol-sa-pabl/,
"Netizen nagreklamong may naninilip, tarpaulin pala!",https://www.abante.com.ph/2023/04/19/netizen-nagreklamong-may-naninilip-tarpaulin-pala/,
"Bilyar, BiFin swimming tampok sa TOPS Forum",https://www.abante.com.ph/2023/04/19/bilyar-bifin-swimming-tampok-sa-tops-forum/,
65-anyos mamshie pasado sa Bar exam,https://www.abante.com.ph/2023/04/19/65-anyos-mamshie-pasado-sa-bar-exam/,
Direk Louie todo iwas sa isyu ng ‘Eat Bulaga’,https://www.abante.com.ph/2023/04/19/direk-louie-todo-iwas-sa-isyu-ng-eat-bulaga/,
Cindy naloka sa payo ni Annabelle,https://www.abante.com.ph/2023/04/19/cindy-naloka-sa-payo-ni-annabelle/,
Problema sa immigration (Part 1),https://www.abante.com.ph/2023/04/19/problema-sa-immigration-part-1/,
"Celine patuloy na kakanta, hindi magpapatalo sa sakit",https://www.abante.com.ph/2023/04/19/celine-patuloy-na-kakanta-hindi-magpapatalo-sa-sakit/,
Max planong magnegosyo ng mga swimwear,https://www.abante.com.ph/2023/04/19/max-planong-magnegosyo-ng-mga-swimwear/,
"Jelai, Buboy ‘di pinagdududahang mag-dyowa",https://www.abante.com.ph/2023/04/19/jelai-buboy-di-pinagdududahang-mag-dyowa/,
Marco pumirma na sa GMA-7,https://www.abante.com.ph/2023/04/19/marco-pumirma-na-sa-gma-7/,
"AbanTV – News | FOOD RIDER LODI SA PAGTUGTOG NG PIANO SA MALL, ‘KAPA’ LANG WEAPON",https://www.abante.com.ph/2023/04/19/abantv-news-food-rider-lodi-sa-pagtugtog-ng-piano-sa-mall-kapa-lang-weapon/,
"Abante Front Page | Balita ngayong Abril 19, 2023",https://www.abante.com.ph/2023/04/19/abante-front-page-balita-ngayong-abril-19-2023/,
AbanTV – News | Opisyal ng CPP-NPA-NDF naaresto sa Malaysia!,https://www.abante.com.ph/2023/04/18/abantv-news-opisyal-ng-cpp-npa-ndf-naaresto-sa-malaysia-2/,
1st quarter pa lang! Higit P19B smuggled goods nasabat ng BOC,https://www.abante.com.ph/2023/04/18/1st-quarter-pa-lang-higit-p19b-smuggled-goods-nasabat-ng-boc/,
PPA sa mga nagpoprotesta vs TOP-CRMS: ‘Maging kalmado tayo’,https://www.abante.com.ph/2023/04/18/ppa-sa-mga-nagpoprotesta-vs-top-crms-maging-kalmado-tayo/,
Divorce bill tinulak ng 7 senador,https://www.abante.com.ph/2023/04/18/divorce-bill-tinulak-ng-7-senador/,
Army kasado sa Durante court martial,https://www.abante.com.ph/2023/04/18/army-kasado-sa-durante-court-martial/,
BBM muling nag-propose kay FL Liza,https://www.abante.com.ph/2023/04/18/bbm-muling-nag-propose-kay-fl-liza/,
Dating DFA Sec Del Rosario pumanaw na,https://www.abante.com.ph/2023/04/18/dating-dfa-sec-del-rosario-pumanaw-na/,
Tongpats sa Senado sumingaw,https://www.abante.com.ph/2023/04/18/tongpats-sa-senado-sumingaw/,
"PBBM inutos pagtitipid ng tubig, kuryente",https://www.abante.com.ph/2023/04/18/pbbm-inutos-pagtitipid-ng-tubig-kuryente/,
1.5M estudyante muntik mag-suicide,https://www.abante.com.ph/2023/04/18/1-5m-estudyante-muntik-mag-suicide/,
"Bato pinalagan banat ng mga Negrense ‘Hindi ako tuta, bayaran ni Teves’",https://www.abante.com.ph/2023/04/18/bato-pinalagan-banat-ng-mga-negrense-hindi-ako-tuta-bayaran-ni-teves/,
"4 ex-drug user, lodi sa Bidahan",https://www.abante.com.ph/2023/04/18/4-ex-drug-user-lodi-sa-bidahan/,
"DPWH sinita sa pagbutas, pagkalkal ng maayos na kalye",https://www.abante.com.ph/2023/04/18/dpwh-sinita-sa-pagbutas-pagkalkal-ng-maayos-na-kalye/,
UN umapela ng tigil-putukan sa Sudan,https://www.abante.com.ph/2023/04/18/un-umapela-ng-tigil-putukan-sa-sudan/,
Higit 100 bahay natupok sa Samar,https://www.abante.com.ph/2023/04/18/higit-100-bahay-natupok-sa-samar/,
"Holdapan sa gasolinahan; 1 patay, 1 pa sugatan",https://www.abante.com.ph/2023/04/18/holdapan-sa-gasolinahan-1-patay-1-pa-sugatan/,
Nene pisak sa jeep ng erpat,https://www.abante.com.ph/2023/04/18/nene-pisak-sa-jeep-ng-erpat/,
"Mag-utol, pinsan luray sa sumambulat na granada",https://www.abante.com.ph/2023/04/18/mag-utol-pinsan-luray-sa-sumambulat-na-granada/,
Mister binoga habang naglilinis ng haybol,https://www.abante.com.ph/2023/04/18/mister-binoga-habang-naglilinis-ng-haybol/,
PBBM pinag-iingat sa susunod na PNP chief,https://www.abante.com.ph/2023/04/18/pbbm-pinag-iingat-sa-susunod-na-pnp-chief/,
Abalos rumesbak kay Azurin: Cover-up buking sa video,https://www.abante.com.ph/2023/04/18/abalos-rumesbak-kay-azurin-cover-up-buking-sa-video/,
Mga trahedya sa Holy Week,https://www.abante.com.ph/2023/04/18/mga-trahedya-sa-holy-week/,
‘P.I.’ ginamit sa ‘Queenmaker’ Korean series,https://www.abante.com.ph/2023/04/18/p-i-ginamit-sa-queenmaker-korean-series/,
Pauline Del Rosario mabagsik mga tirada sa LPGT opening,https://www.abante.com.ph/2023/04/18/pauline-del-rosario-mabagsik-mga-tirada-sa-lpgt-opening/,
Baby Falcons patitigasin ni Fil-Kiwi Jireh Tumaneng,https://www.abante.com.ph/2023/04/18/baby-falcons-patitigasin-ni-fil-kiwi-jireh-tumaneng/,
"ALAMIN: Gamot sa Pigsa, nakakahawa ba, at ilang araw ito tumatagal",https://www.abante.com.ph/2023/04/18/alamin-gamot-sa-pigsa-nakakahawa-ba-at-ilang-araw-ito-tumatagal/,
Miguel Morales nilangoy 5 ginto sa PSL Short Course,https://www.abante.com.ph/2023/04/18/miguel-morales-nilangoy-5-ginto-sa-psl-short-course/,
OP-PMS ginulat NHA; PNP palag pa sa UNTV,https://www.abante.com.ph/2023/04/18/op-pms-ginulat-nha-pnp-palag-pa-sa-untv/,
Pinay make-up artist umaariba sa Switzerland,https://www.abante.com.ph/2023/04/18/pinay-make-up-artist-umaariba-sa-switzerland/,
Karera Tips Ni JP Gonzales,https://www.abante.com.ph/2023/04/18/karera-tips-ni-jp-gonzales-476/,
"Sarah kahit 2 anak so stylish, hindi losyang",https://www.abante.com.ph/2023/04/18/sarah-kahit-2-anak-so-stylish-hindi-losyang/,
Binatilyo tent ginawang tulugan sa loob ng 3 taon,https://www.abante.com.ph/2023/04/18/binatilyo-tent-ginawang-tulugan-sa-loob-ng-3-taon/,
"Angel Canino, DLSU tutuhugin Lady Falcons",https://www.abante.com.ph/2023/04/18/angel-canino-dlsu-tutuhugin-lady-falcons/,
"Rodjun, Dianne nagpasalamat sa paggaling ng anak",https://www.abante.com.ph/2023/04/18/rodjun-dianne-nagpasalamat-sa-paggaling-ng-anak/,
Pinanggigilan ang mga ‘bundok’: Pia mas bumata itsura,https://www.abante.com.ph/2023/04/18/pinanggigilan-ang-mga-bundok-pia-mas-bumata-itsura/,
EA inialay sa yumaong ama acting trophy,https://www.abante.com.ph/2023/04/18/ea-inialay-sa-yumaong-ama-acting-trophy/,
Bebot 14 buwan hindi nakaihi,https://www.abante.com.ph/2023/04/18/bebot-14-buwan-hindi-nakaihi/,
Tim may payo sa mga mag-asawang hiwalay,https://www.abante.com.ph/2023/04/18/tim-may-payo-sa-mga-mag-asawang-hiwalay/,
Lilipat na sa GMA-7 o stay sa ABS-CBN? Enrique may big announcement,https://www.abante.com.ph/2023/04/18/lilipat-na-sa-gma-7-o-stay-sa-abs-cbn-enrique-may-big-announcement/,
"‘That’s very disrespectful’: Vice nasaktan, wig hinila",https://www.abante.com.ph/2023/04/18/thats-very-disrespectful-vice-nasaktan-wig-hinila/,
"Alexa ‘di ok, matindi pinagdaraanan",https://www.abante.com.ph/2023/04/18/alexa-di-ok-matindi-pinagdaraanan/,
Dimples rumampa sa Brazil na naka-Filipiniana blouse,https://www.abante.com.ph/2023/04/18/dimples-rumampa-sa-brazil-na-naka-filipiniana-blouse/,
"Vilma, Boyet pauwi na ng ‘Pinas",https://www.abante.com.ph/2023/04/18/vilma-boyet-pauwi-na-ng-pinas/,
Marlon Tapales gigil magdepensa ng korona,https://www.abante.com.ph/2023/04/18/marlon-tapales-gigil-magdepensa-ng-korona/,
"Karla, Jolina may iringan?",https://www.abante.com.ph/2023/04/18/karla-jolina-may-iringan/,
"Moira busy, walang time mag-dyowa!",https://www.abante.com.ph/2023/04/18/moira-busy-walang-time-mag-dyowa/,
Gardo bumilis tibok ng puso sa kaseksihan ni Sue,https://www.abante.com.ph/2023/04/18/gardo-bumilis-tibok-ng-puso-sa-kaseksihan-ni-sue/,
Fiancé naiyak sa tagumpay ni KaladKaren,https://www.abante.com.ph/2023/04/18/fiance-naiyak-sa-tagumpay-ni-kaladkaren/,
Winwyn na-insecure sa kagandahan ng inang si Alma,https://www.abante.com.ph/2023/04/18/winwyn-na-insecure-sa-kagandahan-ng-inang-si-alma/,
"‘Sonata’, iba pang Pinoy film bumida sa France",https://www.abante.com.ph/2023/04/18/sonata-iba-pang-pinoy-film-bumida-sa-france/,
"De’Aaron Fox, Kings pinabulagta uli GSW",https://www.abante.com.ph/2023/04/18/deaaron-fox-kings-pinabulagta-uli-gsw/,
Abogado proud anak ng karinderya owner,https://www.abante.com.ph/2023/04/18/abogado-proud-anak-ng-karinderya-owner/,
Philip Ella Juico tutuklas ng talento sa G League,https://www.abante.com.ph/2023/04/18/philip-ella-juico-tutuklas-ng-talento-sa-g-league/,
Tonelle Racasa target maging Woman International Master,https://www.abante.com.ph/2023/04/18/tonelle-racasa-target-maging-woman-international-master/,
‘Lagare’ sa Norte,https://www.abante.com.ph/2023/04/18/lagare-sa-norte/,
"Joel Embiid matamlay opensa, nanghalimaw na lang sa rebound",https://www.abante.com.ph/2023/04/18/joel-embiid-matamlay-opensa-nanghalimaw-na-lang-sa-rebound/,
"Shohei Ohtani, LA Angels pinitik Boston Red Sox, 5-4",https://www.abante.com.ph/2023/04/18/shohei-ohtani-la-angels-pinitik-boston-red-sox-5-4/,
"Scottie Thompson, Gin Kings pokus depensa sa Game 5",https://www.abante.com.ph/2023/04/18/scottie-thompson-gin-kings-pokus-depensa-sa-game-5/,
International Master Ronald Bancod pipiga ng utak sa Penang Open 2023,https://www.abante.com.ph/2023/04/18/international-master-ronald-bancod-pipiga-ng-utak-sa-penang-open-2023/,
Moderne Cong bibira sa Chairman’s Cup II,https://www.abante.com.ph/2023/04/18/moderne-cong-bibira-sa-chairmans-cup-ii/,
Nakipaglibig sa panaginip,https://www.abante.com.ph/2023/04/18/nakipaglibig-sa-panaginip/,
Mga patok na Pasyalan sa Intramuros,https://www.abante.com.ph/2023/04/18/mga-patok-na-pasyalan-sa-intramuros/,
Kabataan at agrikultura,https://www.abante.com.ph/2023/04/18/kabataan-at-agrikultura/,
Invisible Bodyguards pala ay ET,https://www.abante.com.ph/2023/04/18/invisible-bodyguards-pala-ay-et/,
"Abante Front Page | Balita ngayong Abril 18, 2023",https://www.abante.com.ph/2023/04/17/abante-front-page-balita-ngayong-abril-18-2023/,
Kung hindi susuko: Cong Teves markahang terorista,https://www.abante.com.ph/2023/04/17/kung-hindi-susuko-cong-teves-markahang-terorista/,
Romualdez: Kababaihan swak sa digital transformation,https://www.abante.com.ph/2023/04/17/romualdez-kababaihan-swak-sa-digital-transformation/,
"BBM nagtalaga ng bagong opisyal sa PCO, BJMP",https://www.abante.com.ph/2023/04/17/bbm-nagtalaga-ng-bagong-opisyal-sa-pco-bjmp/,
Bato bet bakasyon pa more,https://www.abante.com.ph/2023/04/17/bato-bet-bakasyon-pa-more/,
Duty Free PH binitin restructuring plan,https://www.abante.com.ph/2023/04/17/duty-free-ph-binitin-restructuring-plan/,
1.2M toneladang bigas kailangan ng ‘Pinas,https://www.abante.com.ph/2023/04/17/1-2m-toneladang-bigas-kailangan-ng-pinas/,
NTC sinisipat extension ng SIM card registration,https://www.abante.com.ph/2023/04/17/ntc-sinisipat-extension-ng-sim-card-registration/,
"PBBM, Czech Republic PM nagpulong sa Palasyo",https://www.abante.com.ph/2023/04/17/pbbm-czech-republic-pm-nagpulong-sa-palasyo/,
China walang werpa vs 200K OFW sa Taiwan – MECO,https://www.abante.com.ph/2023/04/17/china-walang-werpa-vs-200k-ofw-sa-taiwan-meco/,
"Pagtumba sa gangster na mambabatas, utol hulicam sa India",https://www.abante.com.ph/2023/04/17/pagtumba-sa-gangster-na-mambabatas-utol-hulicam-sa-india/,
4 minasaker sa birthday party,https://www.abante.com.ph/2023/04/17/4-minasaker-sa-birthday-party/,
"Produktong baboy mula Cebu, bawal sa Bohol",https://www.abante.com.ph/2023/04/17/produktong-baboy-mula-cebu-bawal-sa-bohol/,
Sagad sa init na panahon asahan hanggang Biyernes – Pagasa,https://www.abante.com.ph/2023/04/17/sagad-sa-init-na-panahon-asahan-hanggang-biyernes-pagasa/,
Sanggol tsugi sa napabayaang kandila,https://www.abante.com.ph/2023/04/17/sanggol-tsugi-sa-napabayaang-kandila/,
"Manukan nasunog, 21K sisiw natusta",https://www.abante.com.ph/2023/04/17/manukan-nasunog-21k-sisiw-natusta/,
"Magdyowa niratrat sa haybol, dedbol",https://www.abante.com.ph/2023/04/17/magdyowa-niratrat-sa-haybol-dedbol/,
De Lima hahatulan sa Mayo,https://www.abante.com.ph/2023/04/17/de-lima-hahatulan-sa-mayo/,
"Nagpanggap na NBI agent, sundalo arestado",https://www.abante.com.ph/2023/04/17/nagpanggap-na-nbi-agent-sundalo-arestado/,
Pahinante dedo sa tipak ng bato,https://www.abante.com.ph/2023/04/17/pahinante-dedo-sa-tipak-ng-bato/,
"5 motorsiklo inararo ng trak; 2 tigok, 6 sugatan",https://www.abante.com.ph/2023/04/17/5-motorsiklo-inararo-ng-trak-2-tigok-6-sugatan/,
Azurin kay Abalos: Huwag kang ‘patola’!,https://www.abante.com.ph/2023/04/17/azurin-kay-abalos-huwag-kang-patola/,
P150M agri product nabisto ng BOC sa mga NCR bodega,https://www.abante.com.ph/2023/04/17/p150m-agri-product-nabisto-ng-boc-sa-mga-ncr-bodega/,
"Hachimura bumida sa Lakers, pinatumba Memphis sa Game 1",https://www.abante.com.ph/2023/04/17/hachimura-bumida-sa-lakers-pinatumba-memphis-sa-game-1/,
Lalaki sa Canada kinilala bilang may pinakamahabang balbas,https://www.abante.com.ph/2023/04/17/lalaki-sa-canada-kinilala-bilang-may-pinakamahabang-balbas/,
Magtotropa todo hataw kahit isa ang binti,https://www.abante.com.ph/2023/04/17/magtotropa-todo-hataw-kahit-isa-ang-binti/,
Zsa Zsa pinalagyan ng krus ang puntod ni Dolphy,https://www.abante.com.ph/2023/04/17/zsa-zsa-pinalagyan-ng-krus-ang-puntod-ni-dolphy/,
Kahit may mga kontra pa rin: Victor Consunji sinuportahan ng mga netizen,https://www.abante.com.ph/2023/04/17/kahit-may-mga-kontra-pa-rin-victor-consunji-sinuportahan-ng-mga-netizen/,
"Loisa, Ronnie parehas ng trip",https://www.abante.com.ph/2023/04/17/loisa-ronnie-para-ng-trip/,
"Dedma sa mga fan ni David: Barbie, Jak panalo yakapan, harutan",https://www.abante.com.ph/2023/04/17/dedma-sa-mga-fan-ni-david-barbie-jak-panalo-yakapan-harutan/,
Negi kinagigiliwan sa ‘SPG’,https://www.abante.com.ph/2023/04/17/negi-kinagigiliwan-sa-spg/,
"Joshua kinabog Daniel, Alden",https://www.abante.com.ph/2023/04/17/joshua-kinabog-daniel-alden/,
Pinoy bet Melvin Jerusalem abot-kamay pamatay na porma kontra Puerto Rican,https://www.abante.com.ph/2023/04/17/pinoy-bet-melvin-jerusalem-abot-kamay-pamatay-na-porma-kontra-puerto-rican/,
Kib Montalbo walastik ayuda sa Tropang Giga,https://www.abante.com.ph/2023/04/17/kib-montalbo-walastik-ayuda-sa-tropang-giga/,
Pinoy netter Jeson Patrombon dehins papalo sa Cambodia SEAG,https://www.abante.com.ph/2023/04/17/pinoy-netter-jeson-patrombon-dehins-papalo-sa-cambodia-seag/,
"Shelah Mae Cadag, Maegan Alforque armas ng BGC sa 1st Kampeon Cup",https://www.abante.com.ph/2023/04/17/shelah-mae-cadag-maegan-alforque-armas-ng-bgc-sa-1st-kampeon-cup/,
20 koponan bibira sa Asia Tour 3×3,https://www.abante.com.ph/2023/04/17/20-koponan-bibira-sa-asia-tour-3x3/,
"Kelot super laki ng tyan, lumawlaw hanggang legs",https://www.abante.com.ph/2023/04/17/kelot-super-laki-ng-tyan-lumawlaw-hanggang-legs/,
Mamshie bote ng alak ang ginawang dumbbell,https://www.abante.com.ph/2023/04/17/mamshie-bote-ng-alak-ang-ginawang-dumbbell/,
Bea ‘dinogshow’ si Dominic sa TikTok,https://www.abante.com.ph/2023/04/17/bea-dinogshow-si-dominic-sa-tiktok/,
Kim sobrang thankful sa ‘ASAP’,https://www.abante.com.ph/2023/04/17/kim-sobrang-thankful-sa-asap/,
Marian super mama – Dingdong,https://www.abante.com.ph/2023/04/17/marian-super-mama-dingdong/,
"Alden, Julia magsasama sa pelikula",https://www.abante.com.ph/2023/04/17/alden-julia-magsasama-sa-pelikula/,
Donita tagumpay sa balik-alindog,https://www.abante.com.ph/2023/04/17/donita-tagumpay-sa-balik-alindog/,
Vice dinumog sa Edmonton,https://www.abante.com.ph/2023/04/17/vice-dinumog-sa-edmonton/,
Justin Brownlee napigil pasabog dahil maagang na-foul trouble,https://www.abante.com.ph/2023/04/17/justin-brownlee-napigil-pasabog-dahil-maagang-na-foul-trouble/,
Miss Universe owner excited sa pagbisita sa Pilipinas,https://www.abante.com.ph/2023/04/17/miss-universe-owner-excited-sa-pagbisita-sa-pilipinas/,
"Sylvia emotional kina Arjo, Maine",https://www.abante.com.ph/2023/04/17/sylvia-emotional-kina-arjo-maine/,
"Michele Gumabao, PH squad puntirya ginto sa SEA Games",https://www.abante.com.ph/2023/04/17/michele-gumabao-ph-squad-puntirya-ginto-sa-sea-games/,
"Shawn, Camila naghalikan sa Coachella",https://www.abante.com.ph/2023/04/17/shawn-camila-naghalikan-sa-coachella/,
"Jimmy Butler, Miami sinamantala injury ni Giannis Antetokounmpo",https://www.abante.com.ph/2023/04/17/jimmy-butler-miami-sinamantala-injury-ni-giannis-antetokounmpo/,
Donny gustong maging superhero,https://www.abante.com.ph/2023/04/17/donny-gustong-maging-superhero/,
Jameson hindi na-bully sa ‘It’s Showtime’,https://www.abante.com.ph/2023/04/17/jameson-hindi-na-bully-sa-its-showtime/,
‘Dirty Linen’ rarampa sa Amerika,https://www.abante.com.ph/2023/04/17/dirty-linen-rarampa-sa-amerika/,
Sana all! Engineer nilibot 12 Disneyland,https://www.abante.com.ph/2023/04/17/sana-all-engineer-nilibot-12-disneyland/,
"Shooting ni Juday sa Canada, napurnada",https://www.abante.com.ph/2023/04/17/shooting-ni-juday-sa-canada-napurnada/,
"Choco Mucho libero Thang Ponce, partner nagpakasal na",https://www.abante.com.ph/2023/04/17/choco-mucho-libero-thang-ponce-partner-nagpakasal-na/,
Gerrit Cole swabe bato kontra Minnesota Twins,https://www.abante.com.ph/2023/04/17/gerrit-cole-swabe-bato-kontra-minnesota-twins/,
Single tatay napatapos 2 abogado,https://www.abante.com.ph/2023/04/17/single-tatay-nakapagtapos-2-attorney/,
Italian volley player nahulog sa 6th floor,https://www.abante.com.ph/2023/04/17/italian-volley-player-nahulog-sa-6th-floor/,
Richard Bachmann tatalakayin SEAG update sa PSA Forum,https://www.abante.com.ph/2023/04/17/richard-bachmann-tatalakayin-seag-update-sa-psa-forum/,
"Micaela Jasmine Mojdeh nilangoy 3 ginto, 2 pilak",https://www.abante.com.ph/2023/04/17/micaela-jasmine-mojdeh-nilangoy-3-ginto-2-pilak/,
La Trouppei mabagsik sa Road to Triple Crown,https://www.abante.com.ph/2023/04/17/la-trouppei-mabagsik-sa-road-to-triple-crown/,
Campus eSports lalakas sa AcadArena,https://www.abante.com.ph/2023/04/17/campus-esports-lalakas-sa-acadarena/,
"Full-size e-motorsiklo, gagawin na sa Pilipinas",https://www.abante.com.ph/2023/04/17/full-size-e-motorsiklo-gagawin-na-sa-pilipinas/,
AbanTV – News | Opisyal ng CPP-NPA-NDF naaresto sa Malaysia!,https://www.abante.com.ph/2023/04/17/abantv-news-opisyal-ng-cpp-npa-ndf-naaresto-sa-malaysia/,
Para sa mga Dabawenyo,https://www.abante.com.ph/2023/04/17/para-sa-mga-dabawenyo/,
May kasamang ibang lalaki,https://www.abante.com.ph/2023/04/17/may-kasamang-ibang-lalaki/,
Wala tayong obligasyon sa ICC,https://www.abante.com.ph/2023/04/17/wala-tayong-obligasyon-sa-icc/,
ALAMIN: Mga bawal gawin pag may bulutong,https://www.abante.com.ph/2023/04/17/alamin-mga-bawal-gawin-pag-may-bulutong/,
Toktok waging Best Transport App of the Year,https://www.abante.com.ph/2023/04/17/toktok-waging-best-transport-app-of-the-year/,
"Walang kaukulang dokumento, bokya sa benepisyo- ALU counsel",https://www.abante.com.ph/2023/04/17/walang-kaukulang-dokumento-bokya-sa-benepisyo-alu-counsel/,
"Abante Front Page | Balita ngayong Abril 17, 2023",https://www.abante.com.ph/2023/04/16/abante-front-page-balita-ngayong-abril-17-2023/,
PBBM sa CHED: 83 maritime school busisiin,https://www.abante.com.ph/2023/04/16/pbbm-sa-ched-83-maritime-school-busisiin/,
Usec ganid sa kickback,https://www.abante.com.ph/2023/04/16/usec-ganid-sa-kickback/,
Remittance ng mga OFW sa Taiwan mas marami kaysa galing China,https://www.abante.com.ph/2023/04/16/remittance-ng-mga-ofw-sa-taiwan-mas-marami-kaysa-galing-china/,
"VAT refund sa mga turista papalago ng turismo, trabaho",https://www.abante.com.ph/2023/04/16/vat-refund-sa-mga-turista-papalago-ng-turismo-trabaho/,
"Marcos puntirya solar, wind power sa Oriental Mindoro",https://www.abante.com.ph/2023/04/16/marcos-puntirya-solar-wind-power-sa-oriental-mindoro/,
BBM pinakilos DILG para mangisda mga sapol ng oil spill sa karatig-lugar,https://www.abante.com.ph/2023/04/16/bbm-pinakilos-dilg-para-mangisda-mga-sapol-ng-oil-spill-sa-karatig-lugar/,
LTO binasura dagdag medical sa driver’s license,https://www.abante.com.ph/2023/04/16/lto-binasura-dagdag-medical-sa-drivers-license/,
"Bato vs 49 pulis sa P6.7B shabu cover-up : ‘Kahit nasa CCTV, hindi guilty agad’",https://www.abante.com.ph/2023/04/16/bato-vs-49-pulis-sa-p6-7b-shabu-cover-up-kahit-nasa-cctv-hindi-guilty-agad/,
Chinese ambassador binoldyak ni Enrile sa sawsaw EDCA,https://www.abante.com.ph/2023/04/16/chinese-ambassador-binoldyak-ni-enrile-sa-sawsaw-edca/,
"Bulalo, sinigang swak na best soup sa mundo",https://www.abante.com.ph/2023/04/16/bulalo-sinigang-swak-na-best-soup-sa-mundo/,
"Louie Ramirez, Perpetual Help petmalu sa volleyball",https://www.abante.com.ph/2023/04/16/louie-ramirez-perpetual-help-petmalu-sa-volleyball/,
