Statement,Link,Date
"Gumuhong gusali sa Qatar, 2 OFW sugatan",https://www.abante.com.ph/2023/03/24/gumuhong-gusali-sa-qatar-2-ofw-sugatan/,
MMDA number coding scheme suspendido sa Semana Santa,https://www.abante.com.ph/2023/03/24/mmda-number-coding-scheme-suspendido-sa-semana-santa/,
SoKor tutulong sa oil spill cleanup,https://www.abante.com.ph/2023/03/24/sokor-tutulong-sa-oil-spill-cleanup/,
Bangkay bumulaga sa kalsada,https://www.abante.com.ph/2023/03/24/bangkay-bumulaga-sa-kalsada/,
Mga driving school ‘di pa handa sa sistema ng LTO,https://www.abante.com.ph/2023/03/24/mga-driving-school-di-pa-handa-sa-sistema-ng-lto/,
Tumangging makipagbalikan; bebot minartilyo sa ulo ng ex-dyowa,https://www.abante.com.ph/2023/03/24/tumangging-makipagbalikan-bebot-minartilyo-sa-ulo-ng-ex-dyowa/,
Mag-asawa niratrat ng tandem sa Zambo,https://www.abante.com.ph/2023/03/24/mag-asawa-niratrat-ng-tandem-sa-zambo/,
Higit 100 estudyante bulagta sa fire drill,https://www.abante.com.ph/2023/03/24/higit-100-estudyante-bulagta-sa-fire-drill/,
"Mayor Degamo: Cong sabit sa mga patayan: Utol ni Teves yari sa P17M cash, mga boga",https://www.abante.com.ph/2023/03/24/mayor-degamo-cong-sabit-sa-mga-patayan-utol-ni-teves-yari-sa-p17m-cash-mga-boga/,
"Alay kay Tinyente! Christian Standhardinger, Ginebra nakauna sa SMB",https://www.abante.com.ph/2023/03/24/alay-kay-tinyente-christian-standhardinger-ginebra-nakauna-sa-smb/,
"Eya Laure, UST reresbakan AdU",https://www.abante.com.ph/2023/03/24/eya-laure-ust-reresbakan-adu/,
"MJ Phillips, Petro Gazz babasagin Creamline",https://www.abante.com.ph/2023/03/24/mj-phillips-petro-gazz-babasagin-creamline/,
"Tsuper na napagtapos 5 anak sa kolehiyo, pinusuan",https://www.abante.com.ph/2023/03/24/tsuper-na-napagtapos-5-anak-sa-kolehiyo-pinusuan/,
Sarah Dequinan sinungkit pangalawang ginto sa Athletics Open,https://www.abante.com.ph/2023/03/24/sarah-dequinan-sinungkit-pangalawang-ginto-sa-athletics-open/,
LA Tenorio nagwagi kontra colon cancer,https://www.abante.com.ph/2023/03/24/la-tenorio-nagwagi-kontra-colon-cancer/,
"Jerrick Farr, iba pa papadyak sa Cross Country Eliminator",https://www.abante.com.ph/2023/03/24/jerrick-farr-iba-pa-papadyak-sa-cross-country-eliminator/,
"Sharon, Regine enjoy sa US",https://www.abante.com.ph/2023/03/24/sharon-regine-enjoy-sa-us/,
Classic Cup aarangkada,https://www.abante.com.ph/2023/03/24/classic-cup-aarangkada/,
"Kawhi Leonard, Clippers tinuhog Oklahoma City",https://www.abante.com.ph/2023/03/24/kawhi-leonard-clippers-tinuhog-oklahoma-city/,
Karera Tips Ni JP Gonzales,https://www.abante.com.ph/2023/03/24/karera-tips-ni-jp-gonzales-463/,
"COPA, Speedo pakners para palakasin swimming",https://www.abante.com.ph/2023/03/24/copa-speedo-pakners-para-palakasin-swimming/,
Pagbigat at pag-opera,https://www.abante.com.ph/2023/03/24/pagbigat-at-pag-opera/,
"Tiba-tibang tubo sa imported na sukal, Pilipino ang tama",https://www.abante.com.ph/2023/03/24/tiba-tibang-tubo-sa-imported-na-sukal-pilipino-ang-tama/,
Dapat munang pumreno sa pagpapasara ng POGO,https://www.abante.com.ph/2023/03/24/dapat-munang-pumreno-sa-pagpapasara-ng-pogo/,
Sparkle teen actor namatay sa aksidente,https://www.abante.com.ph/2023/03/24/sparkle-teen-actor-namatay-sa-aksidente/,
Darryl Yap nagulat: Direk kamukha mo raw si Herbert – Ruffa,https://www.abante.com.ph/2023/03/24/darryl-yap-nagulat-direk-kamukha-mo-raw-si-herbert-ruffa/,
"Bamboo, KZ, Martin baka mag-bonding sa Tate",https://www.abante.com.ph/2023/03/24/bamboo-kz-martin-baka-mag-bonding-sa-tate/,
KD at Alexa may ‘bebe time’ sa Japan,https://www.abante.com.ph/2023/03/24/kd-at-alexa-may-bebe-time-sa-japan/,
Kahit karelasyon ni Issa si James: Okey po kami Nadine – Yassi,https://www.abante.com.ph/2023/03/24/kahit-karelasyon-ni-issa-si-james-okey-po-kami-nadine-yassi/,
Copper mining prayoridad sa Indigenous group ng South Cotabato,https://www.abante.com.ph/2023/03/24/copper-mining-prayoridad-sa-indigenous-group-ng-south-cotabato/,
Apela sa Malacanang: Taripa sa e-motorcycle suspendihin,https://www.abante.com.ph/2023/03/24/apela-sa-malacanang-taripa-sa-e-motorcycle-suspendihin/,
"Halos kasabay nina Arjo, Maine: Maja-Rambo sa July ang kasal",https://www.abante.com.ph/2023/03/24/halos-kasabay-nina-arjo-maine-maja-rambo-sa-july-ang-kasal/,
"Dahil kay David: Seksing vlogger nagmura, naiyak, naglumpasay",https://www.abante.com.ph/2023/03/24/dahil-kay-david-seksing-vlogger-nagmura-naiyak-naglumpasay/,
AbanTV – Showbiz | Cassy mamimigay ng Black Pink tickets,https://www.abante.com.ph/2023/03/24/abantv-showbiz-cassy-mamimigay-ng-black-pink-tickets/,
"Abante Front Page | Balita ngayong Marso 24, 2023",https://www.abante.com.ph/2023/03/23/abante-front-page-balita-ngayong-marso-24-2023/,
Hontiveros: 33 sinuspinde mga pipitsugin ‘Mastermind ng Pharmally scam kasuhan!’,https://www.abante.com.ph/2023/03/23/hontiveros-33-sinuspinde-mga-pipitsugin-mastermind-ng-pharmally-scam-kasuhan/,
BOI nakatutok sa 90 Chinese investment,https://www.abante.com.ph/2023/03/23/boi-nakatutok-sa-90-chinese-investment/,
"Gov’t exec atat maging senador, laging bitbit mga vlogger",https://www.abante.com.ph/2023/03/23/govt-exec-atat-maging-senador-laging-bitbit-mga-vlogger/,
Daming nangangamote! Mga board exam pinabubuwag,https://www.abante.com.ph/2023/03/23/daming-nangangamote-mga-board-exam-pinabubuwag/,
BBM nakiisa sa pagdiriwang ng Ramadan,https://www.abante.com.ph/2023/03/23/bbm-nakiisa-sa-pagdiriwang-ng-ramadan/,
POGO ban kulang suporta sa Senado,https://www.abante.com.ph/2023/03/23/pogo-ban-kulang-suporta-sa-senado/,
BSP tinaas interes sa pautang,https://www.abante.com.ph/2023/03/23/bsp-tinaas-interes-sa-pautang/,
Niretokeng AFP fixed-term pirma na lang ni Marcos,https://www.abante.com.ph/2023/03/23/niretokeng-afp-fixed-term-pirma-na-lang-ni-marcos/,
Romualdez bumigay sa Con-Ass ni Robin,https://www.abante.com.ph/2023/03/23/romualdez-bumigay-sa-con-ass-ni-robin1/,
‘Pinas may krisis sa tubig – PBBM,https://www.abante.com.ph/2023/03/23/pinas-may-krisis-sa-tubig-pbbm/,
"Gusali sa Qatar gumuho, 30 Pinoy apektado",https://www.abante.com.ph/2023/03/23/gusali-sa-qatar-gumuho-30-pinoy-apektado/,
"UN kinondena parusa ng Uganda vs beki, tibo",https://www.abante.com.ph/2023/03/23/un-kinondena-parusa-ng-uganda-vs-beki-tibo/,
Sementeryo tambakan ng ‘medical waste’,https://www.abante.com.ph/2023/03/23/sementeryo-tambakan-ng-medical-waste/,
Cagayan tinamaan ng magnitude 5.7,https://www.abante.com.ph/2023/03/23/cagayan-tinamaan-ng-magnitude-5-7/,
Magdyowa himas-rehas sa droga,https://www.abante.com.ph/2023/03/23/magdyowa-himas-rehas-sa-droga/,
"Estudyante binoga sa likod, tigok",https://www.abante.com.ph/2023/03/23/estudyante-binoga-sa-likod-tigok/,
Magbayaw bumulagta sa pinulutang palaka,https://www.abante.com.ph/2023/03/23/magbayaw-bumulagta-sa-pinulutang-palaka/,
Pekeng pulis timbog sa pangongotong,https://www.abante.com.ph/2023/03/23/pekeng-pulis-timbog-sa-pangongotong/,
"BIFF iginanti pagtsugi sa lider; 1 sundalo dedo, 2 pa sugatan",https://www.abante.com.ph/2023/03/23/biff-iginanti-pagtsugi-sa-lider-1-sundalo-dedo-2-pa-sugatan/,
Assistant buwis-buhay sa target na Mayor,https://www.abante.com.ph/2023/03/23/assistant-buwis-buhay-sa-target-na-mayor/,
Pinakamabigat na labanos naani sa Japan,https://www.abante.com.ph/2023/03/23/pinakamabigat-na-labanos-naani-sa-japan/,
Goldsmith liyamado sa Condition Race,https://www.abante.com.ph/2023/03/23/goldsmith-liyamado-sa-condition-race/,
"Alessandra, Empoy hanep ang chemistry",https://www.abante.com.ph/2023/03/23/alessandra-empoy-hanep-ang-chemistry/,
Shot puno pa more! 102-anyos lola tuloy ang tagay,https://www.abante.com.ph/2023/03/23/shot-puno-pa-more-102-anyos-lola-tuloy-ang-tagay/,
Mural na gawang Pinoy bumida sa Madrid,https://www.abante.com.ph/2023/03/23/mural-na-gawang-pinoy-bumida-sa-madrid/,
Tagay sa inuman hinahatid ng laruang sasakyan,https://www.abante.com.ph/2023/03/23/tagay-sa-inuman-hinahatid-ng-laruang-sasakyan/,
SEAG Torch Relay idaraos sa Tagaytay,https://www.abante.com.ph/2023/03/23/seag-torch-relay-idaraos-sa-tagaytay/,
Bagong kasal sa Camarines Norte kolong-kolong ang service,https://www.abante.com.ph/2023/03/23/bagong-kasal-sa-camarines-norte-kolong-kolong-ang-service/,
UP Diliman prof nasungkit American geography award,https://www.abante.com.ph/2023/03/23/up-diliman-prof-nasungkit-american-geography-award/,
Leylah Fernandez pinatalsik Ukranian,https://www.abante.com.ph/2023/03/23/leylah-fernandez-pinatalsik-ukranian/,
Matinding sapakan ito! Vincent Astrolabio kasado laban kay Jason Moloney,https://www.abante.com.ph/2023/03/23/matinding-sapakan-ito-vincent-astrolabio-kasado-laban-kay-jason-moloney/,
"Todo na ‘to! Jema Galanza, Creamline handa na sa All-Pinoy finals",https://www.abante.com.ph/2023/03/23/todo-na-to-jema-galanza-creamline-handa-na-sa-all-pinoy-finals/,
"Dadaan sa butas ng karayom! CJ Perez, San Miguel dehado sa Gin Kings",https://www.abante.com.ph/2023/03/23/dadaan-sa-butas-ng-karayom-cj-perez-san-miguel-dehado-sa-gin-kings/,
Joshua sa TikTok na lang nakakapagsayaw,https://www.abante.com.ph/2023/03/23/joshua-sa-tiktok-na-lang-nakakapagsayaw/,
Cebu Chess aarangkada,https://www.abante.com.ph/2023/03/23/cebu-chess-aarangkada/,
"Bianca Pagdanganan, 4 pa papasiklab sa Epson Tour",https://www.abante.com.ph/2023/03/23/bianca-pagdanganan-4-pa-papasiklab-sa-epson-tour/,
Mga pride ng ‘Pinas! Alex Eala binisita si Erik Spoelstra,https://www.abante.com.ph/2023/03/23/mga-pride-ng-pinas-alex-eala-binisita-si-erik-spoelstra/,
"Konti na lang, natalo pa! Kai Sotto, Hiroshima kinapos sa Nagoya",https://www.abante.com.ph/2023/03/23/konti-na-lang-natalo-pa-kai-sotto-hiroshima-kinapos-sa-nagoya/,
Natuto na ng leksiyon! Ja Morant balik-aksiyon matapos ang gun scandal,https://www.abante.com.ph/2023/03/23/natuto-na-ng-leksiyon-ja-morant-balik-aksiyon-matapos-ang-gun-scandal/,
"Mhicaela Belen, Lady Bulldogs ibabalik gutom sa paghambalos",https://www.abante.com.ph/2023/03/23/mhicaela-belen-lady-bulldogs-ibabalik-gutom-sa-paghambalos/,
Kahit nakakapaso ang init: Christine Hallasgo sinikwat ginto sa women’s 10K run,https://www.abante.com.ph/2023/03/23/kahit-nakakapaso-ang-init-christine-hallasgo-sinikwat-ginto-sa-womens-10k-run/,
‘Hari ng Ylocandia 3’ 7-Cock Derby bibira,https://www.abante.com.ph/2023/03/23/hari-ng-ylocandia-3-7-cock-derby-bibira/,
Ivana aminadong naglalasing,https://www.abante.com.ph/2023/03/23/ivana-aminadong-naglalasing/,
Karera Tips Ni JP Gonzales,https://www.abante.com.ph/2023/03/23/karera-tips-ni-jp-gonzales-462/,
Josh Reyes uli sa Gilas U-16,https://www.abante.com.ph/2023/03/23/josh-reyes-uli-sa-gilas-u-16/,
"Todo halik kay Zanjoe: Elisse bagay na malandi, mapangahas",https://www.abante.com.ph/2023/03/23/todo-halik-kay-zanjoe-elisse-bagay-na-malandi-mapangahas/,
Momshie 6 digit weekly ang kita sa cone tip business,https://www.abante.com.ph/2023/03/23/momshie-6-digit-weekly-ang-kita-sa-cone-tip-business/,
Cassy mamimigay ng Black Pink tickets,https://www.abante.com.ph/2023/03/23/cassy-mamimigay-ng-black-pink-tickets/,
Proteksyunan ang kalusugan at kapakanan ng bawat Pilipino laban sa mga banta sa buhay,https://www.abante.com.ph/2023/03/23/proteksyunan-ang-kalusugan-at-kapakanan-ng-bawat-pilipino-laban-sa-mga-banta-sa-buhay/,
"Babaeng multo, nakita sa Intramuros ghost ride ko",https://www.abante.com.ph/2023/03/23/babaeng-multo-nakita-sa-intramuros-ghost-ride-ko/,
Bumisita kahit sa recording: Donny parang boyfriend na ni Belle,https://www.abante.com.ph/2023/03/23/bumisita-kahit-sa-recording-donny-parang-boyfriend-na-ni-belle/,
Julia may ‘hugot’ sa IG post?,https://www.abante.com.ph/2023/03/23/julia-may-hugot-sa-ig-post/,
Dina pahihirapan ang buhay ni Jillian,https://www.abante.com.ph/2023/03/23/dina-pahihirapan-ang-buhay-ni-jillian/,
Barbie tumaba agad sa Tate,https://www.abante.com.ph/2023/03/23/barbie-tumaba-agad-sa-tate/,
"Joey Generoso, Jinky Vidal hindi pasaway",https://www.abante.com.ph/2023/03/23/joey-generoso-jinky-vidal-hindi-pasaway/,
Dahil ipinareha na si Aljon kay Jayda: Karina gustong maging kontrabida,https://www.abante.com.ph/2023/03/23/dahil-ipinareha-na-si-aljon-kay-jayda-karina-gustong-maging-kontrabida/,
‘Love team’ nina Elijah at Kokoy hindi pa tapos,https://www.abante.com.ph/2023/03/23/love-team-nina-elijah-at-kokoy-hindi-pa-tapos/,
"Dina, Gabby mambubulabog sa ‘Abot Kamay Na Pangarap",https://www.abante.com.ph/2023/03/23/dina-gabby-mambubulabog-sa-abot-kamay-na-pangarap/,
"Abante Front Page | Balita ngayong Marso 23, 2023",https://www.abante.com.ph/2023/03/23/abante-front-page-balita-ngayong-marso-23-2023/,
AbanTV – Sports | Walang pahinga! Scottie 4 beses ‘papakin’ ni Larsa Pippen kada araw,https://www.abante.com.ph/2023/03/23/abantv-sports-walang-pahinga-scottie-4-beses-papakin-ni-larsa-pippen-kada-araw/,
"May private jet ka naman – PBBM ‘Teves uwi na, walang papatay sa iyo’",https://www.abante.com.ph/2023/03/22/may-private-jet-ka-naman-pbbm-teves-uwi-na-walang-papatay-sa-iyo/,
"Hontiveros: Smuggled asukal ng Escaler firm, ibenta sa Kadiwa",https://www.abante.com.ph/2023/03/22/hontiveros-smuggled-asukal-ng-escaler-firm-ibenta-sa-kadiwa/,
Senate panel sa Kuwait: Mag-sorry sa pinatay na OFW,https://www.abante.com.ph/2023/03/22/senate-panel-sa-kuwait-mag-sorry-sa-pinatay-na-ofw1/,
BBM niligwak suhestiyon sa oil spill czar,https://www.abante.com.ph/2023/03/22/bbm-niligwak-suhestiyon-sa-oil-spill-czar/,
Kamara inaprub 23 bet ng LEDAC,https://www.abante.com.ph/2023/03/22/kamara-inaprub-23-bet-ng-ledac/,
P5K maximum singil sa driving school kinasa ng LTO,https://www.abante.com.ph/2023/03/22/p5k-maximum-singil-sa-driving-school-kinasa-ng-lto/,
Marcos ibibisto 4 bagong tambayan ng US military sa ‘Pinas,https://www.abante.com.ph/2023/03/22/marcos-ibibisto-4-bagong-tambayan-ng-us-military-sa-pinas/,
Tulfo ‘huhubaran’ aberya sa SSS benepisyo,https://www.abante.com.ph/2023/03/22/tulfo-huhubaran-aberya-sa-sss-benepisyo/,
"Handog ni Marcos: Pabahay sa mga pulis, sundalo ‘niluluto’",https://www.abante.com.ph/2023/03/22/handog-ni-marcos-pabahay-sa-mga-pulis-sundalo-niluluto/,
"Pagawaan ng paputok sumambulat; 7 katao tigok, 15 sugatan",https://www.abante.com.ph/2023/03/22/pagawaan-ng-paputok-sumambulat-7-katao-tigok-15-sugatan/,
"13 dedo sa Afghanistan, Pakistan quake",https://www.abante.com.ph/2023/03/22/13-dedo-sa-afghanistan-pakistan-quake/,
Ramadan simula na ngayong Huwebes,https://www.abante.com.ph/2023/03/22/ramadan-simula-na-ngayong-huwebes1/,
Kauna-unahang cold storage ng sibuyas itatayo sa Nueva Ecija,https://www.abante.com.ph/2023/03/22/kauna-unahang-cold-storage-ng-sibuyas-itatayo-sa-nueva-ecija/,
No. 2 regional target todas sa drug bust,https://www.abante.com.ph/2023/03/22/no-2-regional-target-todas-sa-drug-bust/,
Bebot kulong sa P3K sextortion,https://www.abante.com.ph/2023/03/22/bebot-kulong-sa-p3k-sextortion/,
Turkish timbog sa 3 kilong cocaine,https://www.abante.com.ph/2023/03/22/turkish-timbog-sa-3-kilong-cocaine/,
‘Shabu queen’ dinakma sa Lucena,https://www.abante.com.ph/2023/03/22/shabu-queen-dinakma-sa-lucena/,
8 tiklo sa ‘paihi’,https://www.abante.com.ph/2023/03/22/8-tiklo-sa-paihi/,
Tserman pina-ambus titser na LGBTQ,https://www.abante.com.ph/2023/03/22/tserman-pina-ambus-titser-na-lgbtq/,
PNP tukoy kung nasaan si Teves,https://www.abante.com.ph/2023/03/22/pnp-tukoy-kung-nasaan-si-teves1/,
Nature is the language of art in ‘Kalikhasan’ exhibition,https://www.abante.com.ph/2023/03/22/nature-is-the-language-of-art-in-kalikhasan-exhibition/,
Rondae Hollis-Jefferson binuhat Tropa sa semis,https://www.abante.com.ph/2023/03/22/rondae-hollis-jefferson-binuhat-tropa-sa-semis/,
Mga anak ng Botolan kuminang sa UAAP,https://www.abante.com.ph/2023/03/22/mga-anak-ng-botolan-kuminang-sa-uaap/,
PSC Women’s 9-Ball sasargo,https://www.abante.com.ph/2023/03/22/psc-womens-9-ball-sasargo/,
Daniella Uy lamang ng tatlong palo,https://www.abante.com.ph/2023/03/22/daniella-uy-lamang-ng-tatlong-palo/,
"Sa wakas, nakaganti rin! Angel Canino, De La Salle nilampaso National University",https://www.abante.com.ph/2023/03/22/sa-wakas-nakaganti-rin-angel-canino-de-la-salle-nilampaso-national-university/,
Pakitang-tao lang?,https://www.abante.com.ph/2023/03/22/pakitang-tao-lang/,
"Kath Arado, Speed Hitters kokonektahin silya sa finals",https://www.abante.com.ph/2023/03/22/kath-arado-speed-hitters-kokonektahin-silya-sa-finals/,
Aira Teodosio nasapol unang ginto sa Athletics Open,https://www.abante.com.ph/2023/03/22/aira-teodosio-nasapol-unang-ginto-sa-athletics-open/,
Iba tumrabaho mga lady mayor sa NCR,https://www.abante.com.ph/2023/03/22/iba-tumrabaho-mga-lady-mayor-sa-ncr/,
Yeng Guiao 5 taon ekstensiyon sa Rain or Shine Elasto Painters,https://www.abante.com.ph/2023/03/22/yeng-guiao-5-taon-ekstensiyon-sa-rain-or-shine-elasto-painters/,
"Jhasmin Gayle Pascual, Lady Blazers chill muna",https://www.abante.com.ph/2023/03/22/jhasmin-gayle-pascual-lady-blazers-chill-muna/,
"Mercito Gesta vs Floyd Schofield, Jr. niluluto ng Golden Boy Promotions",https://www.abante.com.ph/2023/03/22/mercito-gesta-vs-floyd-schofield-jr-niluluto-ng-golden-boy-promotions/,
Ibola na ‘yan! Cake bingo ang design,https://www.abante.com.ph/2023/03/22/ibola-na-yan-cake-bingo-ang-design/,
"Cottage na mukhang nitso, aliw sa mga netizen",https://www.abante.com.ph/2023/03/22/cottage-na-mukhang-nitso-aliw-sa-mga-netizen/,
Pinoy film wagi sa US Festival,https://www.abante.com.ph/2023/03/22/pinoy-film-wagi-sa-us-festival/,
Pinoy bet Donato Gamaro runner up sa Eastern Chess,https://www.abante.com.ph/2023/03/22/pinoy-bet-donato-gamaro-runner-up-sa-eastern-chess/,
Mommy Caring makakaliskisan,https://www.abante.com.ph/2023/03/22/mommy-caring-makakaliskisan/,
Bike ng dalawang paslit agaw-pansin sa sobrang haba,https://www.abante.com.ph/2023/03/22/bike-ng-dalawang-paslit-agaw-pansin-sa-sobrang-haba/,
"World Baseball Classic: Shohei Ohtani MVP, Japan kampeon uli",https://www.abante.com.ph/2023/03/22/world-baseball-classic-shohei-ohtani-mvp-japan-kampeon-uli/,
Juice yarn? Sinigang na violet viral,https://www.abante.com.ph/2023/03/22/juice-yarn-sinigang-na-violet-viral/,
Lapitin ng injury! Paul George lumagutok kanang tuhod kontra OKC,https://www.abante.com.ph/2023/03/22/lapitin-ng-injury-paul-george-lumagutok-kanang-tuhod-kontra-okc/,
Smart-MVP summer taekwondo sisiklab,https://www.abante.com.ph/2023/03/22/smart-mvp-summer-taekwondo-sisiklab/,
"Maparaang office worker rumaraket na rider sa gabi, nagpaantig",https://www.abante.com.ph/2023/03/22/maparaang-office-worker-rumaraket-na-rider-sa-gabi-nagpaantig/,
Bawi na lang girl! Alex Eala kinapos sa 2023 Miami Open,https://www.abante.com.ph/2023/03/22/bawi-na-lang-girl-alex-eala-kinapos-sa-2023-miami-open/,
Mga fan nagkagulo sa music video ng Hori7on,https://www.abante.com.ph/2023/03/22/mga-fan-nagkagulo-sa-music-video-ng-hori7on/,
Donny limang oras ‘nakipagharutan’ sa mga fan,https://www.abante.com.ph/2023/03/22/donny-limang-oras-nakipagharutan-sa-mga-fan/,
Tumutulong sa kapwa…Anne amazing woman!,https://www.abante.com.ph/2023/03/22/tumutulong-sa-kapwaanne-amazing-woman/,
Sunshine wasak sa pagpanaw ng tatay,https://www.abante.com.ph/2023/03/22/sunshine-wasak-sa-pagpanaw-ng-tatay/,
"Vic, Maine sitcom goodbye na",https://www.abante.com.ph/2023/03/22/vic-maine-sitcom-goodbye-na/,
Enchong proud groomsman ni Arjo,https://www.abante.com.ph/2023/03/22/enchong-proud-groomsman-ni-arjo/,
Pag-IBIG releases P53.76B cash loans in 2022; Assists record-high 2.61M members,https://www.abante.com.ph/2023/03/22/pag-ibig-releases-p53-76b-cash-loans-in-2022-assists-record-high-2-61m-members/,
Cast reveal ng ‘MAM’ kinakasa na,https://www.abante.com.ph/2023/03/22/cast-reveal-ng-mam-kinakasa-na/,
Anak ni Kris balik ‘Pinas,https://www.abante.com.ph/2023/03/22/anak-ni-kris-balik-pinas/,
Kris hindi ‘ahas’,https://www.abante.com.ph/2023/03/22/kris-hindi-ahas/,
Laganap ang AIDS sa gobyerno?,https://www.abante.com.ph/2023/03/22/laganap-ang-aids-sa-gobyerno/,
Thirdy Galore pinalad sa Singapore,https://www.abante.com.ph/2023/03/22/thirdy-galore-pinalad-sa-singapore/,
"Buwan ng Kababaihan: Pagpapahalaga sa kontribusyon, karapatan ng mga Pinay",https://www.abante.com.ph/2023/03/22/buwan-ng-kababaihan-pagpapahalaga-sa-kontribusyon-karapatan-ng-mga-pinay/,
TikTok at ang mapanganib na pagpapakalat ng disimpormasyon,https://www.abante.com.ph/2023/03/22/tiktok-at-ang-mapanganib-na-pagpapakalat-ng-disimpormasyon/,
"AbanTV – News | TEVES SINAGOT BABALA NI PBBM: ‘WAG AKO LANG, DAPAT LAHAT IMBESTIGAHAN",https://www.abante.com.ph/2023/03/22/abantv-news-teves-sinagot-babala-ni-pbbm-wag-ako-lang-dapat-lahat-imbestigahan/,
"Abante Front Page | Balita ngayong Marso 22, 2023",https://www.abante.com.ph/2023/03/21/abante-front-page-balita-ngayong-marso-22-2023/,
"Asukal cartel titiba ng P7B sa tongpats: Escaler firm, 2 pa ‘tinataga’ mga buyer – Hontiveros",https://www.abante.com.ph/2023/03/21/asukal-cartel-titiba-ng-p7b-sa-tongpats-escaler-firm-2-pa-tinataga-mga-buyer-hontiveros/,
CPA huhubaran ng lisensiya sa P25B resibo scam,https://www.abante.com.ph/2023/03/21/cpa-huhubaran-ng-lisensiya-sa-p25b-resibo-scam/,
Cabinet secretary inindiyan ni gov sa event,https://www.abante.com.ph/2023/03/21/cabinet-secretary-inindiyan-ni-gov-sa-event/,
Romualdez pinush one-strike policy kontra ‘ninja cops’,https://www.abante.com.ph/2023/03/21/romualdez-pinush-one-strike-policy-kontra-ninja-cops/,
MIAA sa mga pasahero: Dumating sa airport 4 oras bago ang flight,https://www.abante.com.ph/2023/03/21/miaa-sa-mga-pasahero-dumating-sa-airport-4-oras-bago-ang-flight/,
4 pang sundalo sa Degamo killing sumuko,https://www.abante.com.ph/2023/03/21/4-pang-sundalo-sa-degamo-killing-sumuko/,
"‘Sibuyas queen’, ibang gigisahin sa Kamara sabay nagkasakit",https://www.abante.com.ph/2023/03/21/sibuyas-queen-ibang-gigisahin-sa-kamara-sabay-nagkasakit/,
Fare discount hinirit ipondo sa PUV modernization,https://www.abante.com.ph/2023/03/21/fare-discount-hinirit-ipondo-sa-puv-modernization/,
Robin: ‘Balls’ lang meron ako! ‘VP para lang sa edukado’,https://www.abante.com.ph/2023/03/21/robin-balls-lang-meron-ako-vp-para-lang-sa-edukado/,
Shot na! Lambanog top 10 best alak worldwide,https://www.abante.com.ph/2023/03/21/shot-na-lambanog-top-10-best-alak-worldwide/,
"Kath Arado, PLDT humirit ng Game 3",https://www.abante.com.ph/2023/03/21/kath-arado-pldt-humirit-ng-game-3/,
8 tangkeng pang-giyera ng Norway nasa Ukraine na,https://www.abante.com.ph/2023/03/21/8-tangkeng-pang-giyera-ng-norway-nasa-ukraine-na/,
Journalist sugatan sa ‘letter bomb’,https://www.abante.com.ph/2023/03/21/journalist-sugatan-sa-letter-bomb/,
Ilang lugar sa NCR mawawalan ng tubig,https://www.abante.com.ph/2023/03/21/0ilang-lugar-sa-ncr-mawawalan-ng-tubig/,
Summer season idineklara ng Pagasa,https://www.abante.com.ph/2023/03/21/summer-season-idineklara-ng-pagasa/,
2 obrero tigbak sa tangke ng ebak,https://www.abante.com.ph/2023/03/21/2-obrero-tigbak-sa-tangke-ng-ebak/,
P400M ‘tobats’ nasamsam ng BOC,https://www.abante.com.ph/2023/03/21/p400m-tobats-nasamsam-ng-boc/,
Kelot bumulagta sa pinaglaruang king cobra,https://www.abante.com.ph/2023/03/21/kelot-bumulagta-sa-pinaglaruang-king-cobra/,
MT Princess Empress na ugat ng oil spill natunton,https://www.abante.com.ph/2023/03/21/mt-princess-empress-na-ugat-ng-oil-spill-natunton/,
"Justine Baltazar, Joshua Flores nagpasiklab sa PSL Dumper Cup",https://www.abante.com.ph/2023/03/21/justine-baltazar-joshua-flores-nagpasiklab-sa-psl-dumper-cup/,
Pinay chesser Marian Calimbo pipiga ng utak sa Malaysia,https://www.abante.com.ph/2023/03/21/pinay-chesser-marian-calimbo-pipiga-ng-utak-sa-malaysia/,
Speaker Romualdez sa PNP: Sibakin agad ‘ninja cops’,https://www.abante.com.ph/2023/03/21/speaker-romualdez-sa-pnp-sibakin-agad-ninja-cops/,
"PBBM, VP Sara, mga NCR mayor, cong mataas approval, trust rating – RPMD",https://www.abante.com.ph/2023/03/21/pbbm-vp-sara-mga-ncr-mayor-cong-mataas-approval-trust-rating-rpmd/,
Judge napuntusan! Piyansa ng suspek sa Batocabe slay binasura ng Court of Appeals,https://www.abante.com.ph/2023/03/21/judge-napuntusan-piyansa-ng-suspek-sa-batocabe-slay-binasura-ng-court-of-appeals/,
Kabiyak ni Gabriel ‘Flash’ Elorde pararangalan sa Banquet of Champions,https://www.abante.com.ph/2023/03/21/kabiyak-ni-gabriel-flash-elorde-pararangalan-sa-banquet-of-champions/,
"Jojo Lastimosa, TNT ‘gigilitan’ Phoenix",https://www.abante.com.ph/2023/03/21/jojo-lastimosa-tnt-gigilitan-phoenix/,
Aldin Ayo dehins tatablahin FiberXers,https://www.abante.com.ph/2023/03/21/aldin-ayo-dehins-tatablahin-fiberxers/,
"Mhicaela Belen, Lady Bulldogs ayaw pakampante kontra DLSU",https://www.abante.com.ph/2023/03/21/mhicaela-belen-lady-bulldogs-ayaw-pakampante-kontra-dlsu/,
Karera Tips Ni JP Gonzales,https://www.abante.com.ph/2023/03/21/karera-tips-ni-jp-gonzales-461/,
"World Baseball Classic finale! Shohei Ohtani, Japan sasagupain Amerika",https://www.abante.com.ph/2023/03/21/world-baseball-classic-finale-shohei-ohtani-japan-sasagupain-amerika/,
"9th UNTV Cup: Trailblazers buhay pa, pinatalsik Defenders",https://www.abante.com.ph/2023/03/21/9th-untv-cup-trailblazers-buhay-pa-pinatalsik-defenders/,
‘Ka Rex Summer League’ didribol,https://www.abante.com.ph/2023/03/21/ka-rex-summer-league-didribol/,
Yari ka kay Pacman! Manny Pacquiao isasagupa kay Conor ‘Destroyer’ Benn,https://www.abante.com.ph/2023/03/21/yari-ka-kay-pacman-manny-pacquiao-isasagupa-kay-conor-destroyer-benn/,
Maparaan! Tubig sa poso ginamitan ng bato pang linis,https://www.abante.com.ph/2023/03/21/maparaan-tubig-sa-poso-ginamitan-ng-bato-pang-linis/,
"Repeat performance sa Candaba, Pampanga",https://www.abante.com.ph/2023/03/21/repeat-performance-sa-candaba-pampanga/,
"Hanep ang Splash Brothers! Steph Curry, Klay Thompson nagsalpak ng tig-5 three points",https://www.abante.com.ph/2023/03/21/hanep-ang-splash-brothers-steph-curry-klay-thompson-nagsalpak-ng-tig-5-three-points/,
