Statement,Link,Date
"AbanTV – Showbiz | Planong paglipat ng Eat Bulaga sa TV5, sumisingaw",https://www.abante.com.ph/2023/05/31/abantv-showbiz-planong-paglipat-ng-eat-bulaga-sa-tv5-sumisingaw/,
Mga negosyante mula Bangkok type mamuhunan sa PH,https://www.abante.com.ph/2023/05/31/mga-negosyante-mula-bangkok-type-mamuhunan-sa-ph/,
Marcos nanawagan na pabakunahan mga tsikiting,https://www.abante.com.ph/2023/05/31/marcos-nanawagan-na-pabakunahan-mga-tsikiting/,
Tulfo nakahanda 120 panukalang batas,https://www.abante.com.ph/2023/05/31/tulfo-nakahanda-120-panukalang-batas/,
BBM inarbor mga ‘tambaloslos’ kay Sara,https://www.abante.com.ph/2023/05/31/bbm-inarbor-mga-tambaloslos-kay-sara/,
Presyo ng bilihin bumaba noong Mayo – BSP,https://www.abante.com.ph/2023/05/31/presyo-ng-bilihin-bumaba-noong-mayo-bsp/,
Dagdag pensiyon sa mga beterano inaprub,https://www.abante.com.ph/2023/05/31/dagdag-pensiyon-sa-mga-beterano-inaprub/,
P54B kinarga sa utang ng ‘Pinas,https://www.abante.com.ph/2023/05/31/p54b-kinarga-sa-utang-ng-pinas/,
NGCP pinatino transmission grid,https://www.abante.com.ph/2023/05/31/ngcp-pinatino-transmission-grid/,
"PBBM ‘di isusugal SSS, GSIS pondo sa Maharlika",https://www.abante.com.ph/2023/05/31/pbbm-di-isusugal-sss-gsis-pondo-sa-maharlika/,
WHO sa Russia: Lubayan mga ospital ng Ukraine,https://www.abante.com.ph/2023/05/31/who-sa-russia-lubayan-mga-ospital-ng-ukraine/,
Dating US First Lady tinamaan ng dementia,https://www.abante.com.ph/2023/05/31/dating-us-first-lady-tinamaan-ng-dementia/,
Anti-Red Tape award nasungkit uli ng Navotas,https://www.abante.com.ph/2023/05/31/anti-red-tape-award-nasungkit-uli-ng-navotas/,
"Kaso ng HIV sa Aklan sumirit, 2 tsugi",https://www.abante.com.ph/2023/05/31/kaso-ng-hiv-sa-aklan-sumirit-2-tsugi/,
Pulis timbog sa STL bookies,https://www.abante.com.ph/2023/05/31/pulis-timbog-sa-stl-bookies/,
P900M kontrabando nabisto ng BOC,https://www.abante.com.ph/2023/05/31/p900m-kontrabando-nabisto-ng-boc/,
2 kagawad na tinik sa eleksyon iniligpit,https://www.abante.com.ph/2023/05/31/2-kagawad-na-tinik-sa-eleksyon-iniligpit/,
Canteen owner tinigok sa loob ng puwesto,https://www.abante.com.ph/2023/05/31/canteen-owner-tinigok-sa-loob-ng-puwesto/,
Quezon inuga ng magnitude 4.9,https://www.abante.com.ph/2023/05/31/quezon-inuga-ng-magnitude-4-9/,
Brodkaster todas sa tandem,https://www.abante.com.ph/2023/05/31/brodkaster-todas-sa-tandem/,
"Christopher Yue, Angelito Guloya ginto sa 1st Asian Para Tenpin Bowling",https://www.abante.com.ph/2023/05/31/christopher-yue-angelito-guloya-ginto-sa-1st-asian-para-tenpin-bowling1/,
"Bed scene nina Jodi, Joshua makalusot kaya sa free TV?",https://www.abante.com.ph/2023/05/31/bed-scene-nina-jodi-joshua-makalusot-kaya-sa-free-tv/,
"Quezon City Gerflor Defenders bubuhatin nina Carmina Aganon, Alyssa Bertolano",https://www.abante.com.ph/2023/05/31/quezon-city-gerflor-defenders-bubuhatin-nina-carmina-aganon-alyssa-bertolano/,
Lian ayaw na mag-comment about Paolo,https://www.abante.com.ph/2023/05/31/lian-ayaw-na-mag-comment-about-paolo/,
"Hiwalayan ng LizQuen, trending",https://www.abante.com.ph/2023/05/31/hiwalayan-ng-lizquen-trending/,
"Ariana Evangelista, MTB squad kumolekta ng 100 Olympic points",https://www.abante.com.ph/2023/05/31/ariana-evangelista-mtb-squad-kumolekta-ng-100-olympic-points/,
"TikToker pauso sa sinigang na hotdog, siomai",https://www.abante.com.ph/2023/05/31/tiktoker-pauso-sa-sinigang-na-hotdog-siomai/,
Pinay bet Rianne Mikhaela Malixi makikipagsabayan sa LPGA Tour,https://www.abante.com.ph/2023/05/31/pinay-bet-rianne-mikhaela-malixi-makikipagsabayan-sa-lpga-tour/,
"Tela, burdang Pinoy tampok sa Morocco",https://www.abante.com.ph/2023/05/31/tela-burdang-pinoy-tampok-sa-morocco/,
"Para mas swabe tumbok! Tako, gamit sa bilyar dapat moderno – Dennis Orcullo",https://www.abante.com.ph/2023/05/31/para-mas-swabe-tumbok-tako-gamit-sa-bilyar-dapat-moderno-dennis-orcullo/,
"KDLex Times Square billboard, ginastusan ng mga fan",https://www.abante.com.ph/2023/05/31/kdlex-times-square-billboard-ginastusan-ng-mga-fan/,
Ilang sports clinic inilunsad ng Milo,https://www.abante.com.ph/2023/05/31/ilang-sports-clinic-inilunsad-ng-milo/,
Paalam ‘Eat Bulaga’,https://www.abante.com.ph/2023/05/31/paalam-eat-bulaga/,
Tuloy raw sa TV5: TVJ ‘di sa noontime ikakasa,https://www.abante.com.ph/2023/05/31/tuloy-raw-sa-tv5-tvj-di-sa-noontime-ikakasa/,
Food rider na naka-bike nagpaantig sa mga netizen,https://www.abante.com.ph/2023/05/31/food-rider-na-naka-bike-nagpaantig-sa-mga-netizen/,
Taga-Baguio nasungkit Top 1 sa CPA board exam,https://www.abante.com.ph/2023/05/31/taga-baguio-nasungkit-top-1-sa-cpa-board-exam/,
‘Wag paloloko! ‘Snooky’ nanghihingi ng pera,https://www.abante.com.ph/2023/05/31/wag-paloloko-snooky-nanghihingi-ng-pera/,
Underwater cross agaw-eksena sa Cebu,https://www.abante.com.ph/2023/05/31/underwater-cross-agaw-eksena-sa-cebu/,
Mga magsasaka ng Batangas sinaklolohan ni Speaker,https://www.abante.com.ph/2023/05/31/mga-magsasaka-ng-batangas-sinaklolohan-ni-speaker/,
Kolehiyala ginawang negosyo pagtatahi ng OOTD,https://www.abante.com.ph/2023/05/31/kolehiyala-ginawang-negosyo-pagtatahi-ng-ootd/,
"Kung ayaw, huwag pilitin! Converge dehins hahabulin si Maverick Ahanmisi",https://www.abante.com.ph/2023/05/31/kung-ayaw-huwag-pilitin-converge-dehins-hahabulin-si-maverick-ahanmisi/,
Mas malakas na gamot sa ubo kailangan dahil sa COVID – Unilab,https://www.abante.com.ph/2023/05/31/mas-malakas-na-gamot-sa-ubo-kailangan-dahil-sa-covid-unilab/,
Alex Eala dumaan sa butas ng karayom,https://www.abante.com.ph/2023/05/31/alex-eala-dumaan-sa-butas-ng-karayom1/,
Jennylyn todo paseksi para kay Xian,https://www.abante.com.ph/2023/05/31/jennylyn-todo-paseksi-para-kay-xian/,
Sisi Rondina tamang timpla sa Choco Mucho,https://www.abante.com.ph/2023/05/31/sisi-rondina-tamang-timpla-sa-choco-mucho/,
Nagpapraktis na! Nikola Jokic iaalay korona sa pamilya,https://www.abante.com.ph/2023/05/31/nagpapraktis-na-nikola-jokic-iaalay-korona-sa-pamilya/,
Pagkamatay ni RK sa serye ni Coco inalmahan,https://www.abante.com.ph/2023/05/31/pagkamatay-ni-rk-sa-serye-ni-coco-inalmahan/,
"Miles Mikolas, Cardinals naigapang panalo sa Royals",https://www.abante.com.ph/2023/05/31/miles-mikolas-cardinals-naigapang-panalo-sa-royals/,
Mark Magsayo aakyat ng timbang,https://www.abante.com.ph/2023/05/31/mark-magsayo-aakyat-ng-timbang/,
Karanasan sa MVIC Otis,https://www.abante.com.ph/2023/05/31/karanasan-sa-mvic-otis-2/,
Proteksyon para sa kinabukasan,https://www.abante.com.ph/2023/05/31/proteksyon-para-sa-kinabukasan/,
2 senador tsismis inatupag sa sesyon,https://www.abante.com.ph/2023/05/31/2-senador-tsismis-inatupag-sa-sesyon/,
Kristoffer good provider sa misis at anak,https://www.abante.com.ph/2023/05/31/kristoffer-good-provider-sa-misis-at-anak/,
"1st Grand Santacruzan sa Botolan, Zambales dinumog",https://www.abante.com.ph/2023/05/31/1st-grand-santacruzan-sa-botolan-zambales-dinumog/,
"Mga batang petmalu! Sophia Catantan, Antonio Manuel tinusok ginto sa Junior Fencing",https://www.abante.com.ph/2023/05/31/mga-batang-petmalu-sophia-catantan-antonio-manuel-tinusok-ginto-sa-junior-fencing/,
PSC hinahanda SEAG insentibo,https://www.abante.com.ph/2023/05/31/psc-hinahanda-seag-insentibo/,
3YO Locally Bred Stakes Race aariba,https://www.abante.com.ph/2023/05/31/3yo-locally-bred-stakes-race-aariba/,
Kesa piliin masasamang bisyo! Grandmaster Eugene Torre hinikayat kabataan sa chess,https://www.abante.com.ph/2023/05/31/kesa-piliin-masasamang-bisyo-grandmaster-eugene-torre-hinikayat-kabataan-sa-chess/,
Maxine emotional sa bachelorette party,https://www.abante.com.ph/2023/05/31/maxine-emotional-sa-bachelorette-party/,
Mermaid movie ni Halle Bailey nag-number one,https://www.abante.com.ph/2023/05/31/mermaid-movie-ni-halle-bailey-nag-number-one/,
Performance ng Alamat nabalewala,https://www.abante.com.ph/2023/05/31/performance-ng-alamat-nabalewala/,
Bulakenya accountancy student pak na pak sa make-up negosyo,https://www.abante.com.ph/2023/05/31/bulakenya-accountancy-student-pak-na-pak-sa-make-up-negosyo/,
Amador Inlayo goes from landscape to Cubism with a twist in ARTablado exhibition,https://www.abante.com.ph/2023/05/31/amador-inlayo-goes-from-landscape-to-cubism-with-a-twist-in-artablado-exhibition/,
"Abante Front Page | Balita ngayong Mayo 31, 2023",https://www.abante.com.ph/2023/05/31/abante-front-page-balita-ngayong-mayo-31-2023/,
ERC dinikdik sa kuryente tongpats,https://www.abante.com.ph/2023/05/30/erc-dinikdik-sa-kuryente-tongpats/,
"Opisyal hinanap sa dam nahulog na cp habang nagse-selfie, sinuspinde",https://www.abante.com.ph/2023/05/30/opisyal-hinanap-sa-dam-nahulog-na-cp-habang-nagse-selfie-sinuspinde/,
"15-anyos sumunog ng dorm, swak sa 19 murder case",https://www.abante.com.ph/2023/05/30/15-anyos-sumunog-ng-dorm-swak-sa-19-murder-case/,
298 iskul sa Western Visayas balik online dahil kay ‘Betty’,https://www.abante.com.ph/2023/05/30/298-iskul-sa-western-visayas-balik-online-dahil-kay-betty/,
Ikalawang SONA ni Marcos mas maraming bisita,https://www.abante.com.ph/2023/05/30/ikalawang-sona-ni-marcos-mas-maraming-bisita/,
Malacañang tour sa dalawang museum bubuksan na,https://www.abante.com.ph/2023/05/30/malacanang-tour-sa-dalawang-museum-bubuksan-na/,
5 na tigok! Rabies outbreak idineklara sa Ilocos Norte,https://www.abante.com.ph/2023/05/30/5-na-tigok-rabies-outbreak-idineklara-sa-ilocos-norte/,
PBBM pinarerepaso tax incentive sa mga negosyo,https://www.abante.com.ph/2023/05/30/pbbm-pinarerepaso-tax-incentive-sa-mga-negosyo/,
"Sugatang lider, bomber ng BIFF nadakma sa ospital",https://www.abante.com.ph/2023/05/30/sugatang-lider-bomber-ng-biff-nadakma-sa-ospital/,
"Kagawad umepal sa away ng magdyowa, bumulagta",https://www.abante.com.ph/2023/05/30/kagawad-umepal-sa-away-ng-magdyowa-bumulagta/,
Tutok sa Senado! Robin kumalas na PDP-Laban exec,https://www.abante.com.ph/2023/05/30/tutok-sa-senado-robin-kumalas-na-pdp-laban-exec/,
Killer ng resort caretaker nakorner,https://www.abante.com.ph/2023/05/30/killer-ng-resort-caretaker-nakorner/,
1M Pinoy worker target ng Saudi Arabia,https://www.abante.com.ph/2023/05/30/1m-pinoy-worker-target-ng-saudi-arabia1/,
"Bato binawi contempt sa 6 pulis, pinalaya",https://www.abante.com.ph/2023/05/30/bato-binawi-contempt-sa-6-pulis-pinalaya/,
3 Koreano timbog sa aktong bumabatak,https://www.abante.com.ph/2023/05/30/3-koreano-timbog-sa-aktong-bumabatak/,
Villar brinaso Maharlika bill,https://www.abante.com.ph/2023/05/30/villar-brinaso-maharlika-bill/,
PNP kinakapa banta sa SONA ni PBBM,https://www.abante.com.ph/2023/05/30/pnp-kinakapa-banta-sa-sona-ni-pbbm/,
Ex-PBA player Poligrates nabaril ng teenager,https://www.abante.com.ph/2023/05/30/ex-pba-player-poligrates-nabaril-ng-teenager/,
Villafuerte tinukuran BI Modernization bill,https://www.abante.com.ph/2023/05/30/villafuerte-tinukuran-bi-modernization-bill/,
Para sa kanyang ex: Deserve niyang maging masaya! – Paolo,https://www.abante.com.ph/2023/05/30/para-sa-kanyang-ex-deserve-niyang-maging-masaya-paolo/,
Albee tahimik sa balitang ililipat TVJ sa TV5,https://www.abante.com.ph/2023/05/30/albee-tahimik-sa-balitang-ililipat-tvj-sa-tv5/,
Call center agent work pa rin kahit nasa walwalan,https://www.abante.com.ph/2023/05/30/call-center-agent-work-pa-rin-kahit-nasa-walwalan/,
Bagong hack? E-bike ginamit panlampaso,https://www.abante.com.ph/2023/05/30/bagong-hack-e-bike-ginamit-panlampaso/,
"Marinero nagising, pinabagsak CEU",https://www.abante.com.ph/2023/05/30/marinero-nagising-pinabagsak-ceu/,
Juliana Gomez ginto sa Malaysia,https://www.abante.com.ph/2023/05/30/juliana-gomez-ginto-sa-malaysia/,
Hanep! Biker pedal gamit na manibela,https://www.abante.com.ph/2023/05/30/hanep-biker-pedal-gamit-na-manibela/,
Melvin Jerusalem nahirapan sa malamig na klima kaya natalo,https://www.abante.com.ph/2023/05/30/melvin-jerusalem-nahirapan-sa-malamig-na-klima-kaya-natalo/,
"Caticlan, Cebu swak sa Google top destination",https://www.abante.com.ph/2023/05/30/caticlan-cebu-swak-sa-google-top-destination/,
Jovelyn Gonzaga palalakasin opensa ng Cignal HD Spikers,https://www.abante.com.ph/2023/05/30/jovelyn-gonzaga-palalakasin-opensa-ng-cignal-hd-spikers/,
Mandaluyong tinibag Builders,https://www.abante.com.ph/2023/05/30/mandaluyong-tinibag-builders/,
Paolo tahimik sa engagement ng ex,https://www.abante.com.ph/2023/05/30/paolo-tahimik-sa-engagement-ng-ex/,
Lovi producer na,https://www.abante.com.ph/2023/05/30/lovi-producer-na/,
Kai Sotto kasado na sa Utah Jazz mini camp,https://www.abante.com.ph/2023/05/30/kai-sotto-kasado-na-sa-utah-jazz-mini-camp/,
Karera Tips Ni JP Gonzales,https://www.abante.com.ph/2023/05/30/karera-tips-ni-jp-gonzales-491/,
"Briana Labadan, Daniela Dela Pisa papasiklab sa Ryhtmic Gymnastics",https://www.abante.com.ph/2023/05/30/briana-labadan-daniela-dela-pisa-papasiklab-sa-ryhtmic-gymnastics/,
"LJ nanggulat, engaged na",https://www.abante.com.ph/2023/05/30/lj-nanggulat-engaged-na/,
Bianca ang galing sa martial arts,https://www.abante.com.ph/2023/05/30/bianca-ang-galing-sa-martial-arts/,
8 na-food poison sa malaking liga,https://www.abante.com.ph/2023/05/30/8-na-food-poison-sa-malaking-liga/,
"Ryan Noda, Athletics inilampaso Braves",https://www.abante.com.ph/2023/05/30/ryan-noda-athletics-inilampaso-braves/,
Eula nagdabog sa kabastusan ng ibang mga young star,https://www.abante.com.ph/2023/05/30/eula-nagdabog-sa-kabastusan-ng-ibang-mga-young-star/,
"Chairman Richard Bachmann, mga PSC commissioner palalakasin atletang Pinoy",https://www.abante.com.ph/2023/05/30/chairman-richard-bachmann-mga-psc-commissioner-palalakasin-atletang-pinoy/,
Sulit basketball clinic sa Amerika,https://www.abante.com.ph/2023/05/30/sulit-basketball-clinic-sa-amerika/,
"‘Lola’s girl ako’: KC iwas intriga kina Sharon, Gabby",https://www.abante.com.ph/2023/05/30/lolas-girl-ako-kc-iwas-intriga-kina-sharon-gabby/,
Louie Romero isang taon pa sa Adamson Lady Falcons,https://www.abante.com.ph/2023/05/30/louie-romero-isang-taon-pa-sa-adamson-lady-falcons/,
"Kahit matibay ang pagsasama: Yasmien, mister palaging nag-aaway",https://www.abante.com.ph/2023/05/30/kahit-matibay-ang-pagsasama-yasmien-mister-palaging-nag-aaway/,
Abu Tratter kakasahan mga dating katsokaran,https://www.abante.com.ph/2023/05/30/abu-tratter-kakasahan-mga-dating-katsokaran/,
Inigo Pascual kampi kay Moira Dela Torre,https://www.abante.com.ph/2023/05/30/inigo-pascual-kampi-kay-moira-dela-torre/,
Wesley So pumanglima sa Norway Chess Blitz,https://www.abante.com.ph/2023/05/30/wesley-so-pumanglima-sa-norway-chess-blitz/,
Jane kinilabutan sa mensahe ni Direk Cathy,https://www.abante.com.ph/2023/05/30/jane-kinilabutan-sa-mensahe-ni-direk-cathy/,
Pagbabago ang kailangan,https://www.abante.com.ph/2023/05/30/pagbabago-ang-kailangan/,
AbanTV – Showbiz | Eula Valdes bet ipagawa ilong,https://www.abante.com.ph/2023/05/30/abantv-showbiz-eula-valdes-bet-ipagawa-ilong/,
Santacruzan nangabog sa New York City,https://www.abante.com.ph/2023/05/30/santacruzan-nangabog-sa-new-york-city/,
"Susuwagin Nuggets! Jimmy Butler, Miami biyaheng NBA Finals",https://www.abante.com.ph/2023/05/30/susuwagin-nuggets-jimmy-butler-miami-biyaheng-nba-finals/,
Kolehiyalang negosyante na may kakaibang ‘ganti’ sa mga body shamer,https://www.abante.com.ph/2023/05/30/kolehiyalang-negosyante-na-may-kakaibang-ganti-sa-mga-body-shamer/,
Robin Hood kumaripas,https://www.abante.com.ph/2023/05/30/robin-hood-kumaripas/,
"Jayda, Aljon todo yakapan sa Legaspi",https://www.abante.com.ph/2023/05/30/jayda-aljon-todo-yakapan-sa-legaspi/,
Puntod sa panaginip,https://www.abante.com.ph/2023/05/30/puntod-sa-panaginip/,
Maikli ang buhay!,https://www.abante.com.ph/2023/05/30/maikli-ang-buhay/,
"Isko sobrang proud sa anak: Pagganap na transwoman ni Joaquin, naintriga",https://www.abante.com.ph/2023/05/30/isko-sobrang-proud-sa-anak-pagganap-na-transwoman-ni-joaquin-naintriga/,
Andi bonding sa pamilya ang crab hunting,https://www.abante.com.ph/2023/05/30/andi-bonding-sa-pamilya-ang-crab-hunting/,
Carla BFF na si Beauty,https://www.abante.com.ph/2023/05/30/carla-bff-na-si-beauty/,
Mga issue sinagot! I did not cheat on Jason – Moira,https://www.abante.com.ph/2023/05/30/mga-issue-sinagot-i-did-not-cheat-on-jason-moira-2/,
Mga issue sinagot! I did not cheat on Jason – Moira,https://www.abante.com.ph/2023/05/30/mga-issue-sinagot-i-did-not-cheat-on-jason-moira/,
"Abante Front Page | Balita ngayong Mayo 30, 2023",https://www.abante.com.ph/2023/05/30/abante-front-page-balita-ngayong-mayo-30-2023/,
AbanTV – Horoscope | Ano ang zodiac sign mo? Alamin ang gabay sa iyong kapalaran ngayong araw!,https://www.abante.com.ph/2023/05/29/abantv-horoscope-ano-ang-zodiac-sign-mo-alamin-ang-gabay-sa-iyong-kapalaran-ngayong-araw/,
Mga Anghel nagpakita sa spiritual event,https://www.abante.com.ph/2023/05/29/mga-anghel-nagpakita-sa-spiritual-event/,
Robin lelektyuran sa ‘pagkakalat’,https://www.abante.com.ph/2023/05/29/robin-lelektyuran-sa-pagkakalat/,
"Ilocos, 6 pang rehiyon tambak private army",https://www.abante.com.ph/2023/05/29/ilocos-6-pang-rehiyon-tambak-private-army/,
MIF Corp susuyurin mga investment sa PSE,https://www.abante.com.ph/2023/05/29/mif-corp-susuyurin-mga-investment-sa-pse/,
Teves papatawan ng mabigat na parusa sa Kamara,https://www.abante.com.ph/2023/05/29/teves-papatawan-ng-mabigat-na-parusa-sa-kamara/,
Mga negosyo oobligahin maglagay ng CCTV,https://www.abante.com.ph/2023/05/29/mga-negosyo-oobligahin-maglagay-ng-cctv/,
Nestlé kinuyog sa mga sinipang worker,https://www.abante.com.ph/2023/05/29/nestle-kinuyog-sa-mga-sinipang-worker/,
Pekeng pulis pinakukulong ng 10 taon,https://www.abante.com.ph/2023/05/29/pekeng-pulis-pinakukulong-ng-10-taon/,
"VP Sara, Raffy banggaan sa 2028",https://www.abante.com.ph/2023/05/29/vp-sara-raffy-banggaan-sa-2028/,
"P900M mga puslit na yosi, kargamento bumulaga sa inspeksiyon ng BOC",https://www.abante.com.ph/2023/05/29/p900m-mga-puslit-na-yosi-kargamento-bumulaga-sa-inspeksiyon-ng-boc1/,
"Grand Canal sa Rome, nagkulay-berde",https://www.abante.com.ph/2023/05/29/grand-canal-sa-rome-nagkulay-berde/,
Tag-ulan na! – PAGASA,https://www.abante.com.ph/2023/05/29/tag-ulan-na-pagasa/,
Pulis nagbuwis ng buhay sa 2 paslit,https://www.abante.com.ph/2023/05/29/pulis-nagbuwis-ng-buhay-sa-2-paslit/,
Traffic enforcer tigok sa senglot na rider,https://www.abante.com.ph/2023/05/29/traffic-enforcer-tigok-sa-senglot-na-rider/,
Chinese tiklo sa door to door overnight sex,https://www.abante.com.ph/2023/05/29/chinese-tiklo-sa-door-to-door-overnight-sex/,
"Misis na nurse todas, mister kritikal sa ambush",https://www.abante.com.ph/2023/05/29/misis-na-nurse-todas-mister-kritikal-sa-ambush/,
PH Slo-Pitch squad pasok sa World Cup,https://www.abante.com.ph/2023/05/29/ph-slow-pitch-squad-pasok-sa-world-cup1/,
Jemyca Aribado wagi sa Singapore squash,https://www.abante.com.ph/2023/05/29/jemyca-aribado-wagi-sa-singapore-squash/,
Marinero pipitasin silya sa semifinals,https://www.abante.com.ph/2023/05/29/marinero-pipitasin-silya-sa-semifinals/,
Pinoy boxer Virgel Vitor pinatulog pambato ng Thailand,https://www.abante.com.ph/2023/05/29/pinoy-boxer-virgel-vitor-pinatulog-pambato-ng-thailand/,
Tutulungan Creamline! Bernadeth Pons susubukan punan papel ni Alyssa Valdez,https://www.abante.com.ph/2023/05/29/tutulungan-creamline-bernadeth-pons-susubukan-punan-papel-ni-alyssa-valdez/,
"Dickie Bachmann, PSC Board bisita sa lingguhang PSA Forum",https://www.abante.com.ph/2023/05/29/dickie-bachmann-psc-board-bisita-sa-lingguhang-psa-forum/,
Resto crew ala macho dancer sa paggiling,https://www.abante.com.ph/2023/05/29/resto-crew-ala-macho-dancer-sa-paggiling/,
Estudyante binitbit larawan ng yumaong magulang sa graduation,https://www.abante.com.ph/2023/05/29/estudyante-binitbit-larawan-ng-yumaong-magulang-sa-graduation/,
"Pagsama ni Paulo kay Janine sa Tate, bulilyaso!",https://www.abante.com.ph/2023/05/29/pagsama-ni-paulo-kay-janine-sa-tate-bulilyaso/,
Grade 10 sa NegOcc walang kamay cartoonist champion!,https://www.abante.com.ph/2023/05/29/grade-10-sa-negocc-walang-kamay-cartoonist-champion/,
Sharon nagmukhang bagets sa new hairstyle,https://www.abante.com.ph/2023/05/29/sharon-nagmukhang-bagets-sa-new-hairstyle/,
Vance Larena nalampasan mental health problem,https://www.abante.com.ph/2023/05/29/vance-larena-nalampasan-mental-health-problem/,
"Jimmy Butler, Miami Heat iiwas maging katawa-tawa",https://www.abante.com.ph/2023/05/29/jimmy-butler-miami-heat-iiwas-maging-katawa-tawa/,
"Kate, Kelvin bagay na magdyowa",https://www.abante.com.ph/2023/05/29/kate-kelvin-bagay-na-magdyowa/,
"Nadala lang ng emosyon! Raul Soyud, Raymar Jose nagsikuhan tapos nagyakapan",https://www.abante.com.ph/2023/05/29/nadala-lang-ng-emosyon-raul-soyud-raymar-jose-nagsikuhan-tapos-nagyakapan/,
"Moira hindi manggagamit, walang ghostwriter",https://www.abante.com.ph/2023/05/29/moira-hindi-manggagamit-walang-ghostwriter/,
UST overall champ pa rin,https://www.abante.com.ph/2023/05/29/ust-overall-champ-pa-rin/,
"Dagdag ligtas point? Sapatos na Mama Mary design, viral",https://www.abante.com.ph/2023/05/29/dagdag-ligtas-point-sapatos-na-mama-mary-design-viral/,
"Janry Ubas, Sonny Wagdos nagdagdag ng pilak sa Taiwan Open",https://www.abante.com.ph/2023/05/29/janry-ubas-sonny-wagdos-nagdagdag-ng-pilak-sa-taiwan-open/,
"Family bonding na rin: Dingdong, Marian nagpa-block screening ng ‘Little Mermaid’",https://www.abante.com.ph/2023/05/29/family-bonding-na-rin-dingdong-marian-nagpa-block-screening-ng-little-mermaid/,
"Ray-Ray Parks, Kiefer Ravena, iba pa makakabalik sa PBA",https://www.abante.com.ph/2023/05/29/ray-ray-parks-kiefer-ravena-iba-pa-makakabalik-sa-pba/,
"Claudine, Raymart may ‘reunion’",https://www.abante.com.ph/2023/05/29/claudine-raymart-may-reunion/,
Ariana Evangelista tanso sa Yawatahama MTB Cup,https://www.abante.com.ph/2023/05/29/ariana-evangelista-tanso-sa-yawatahama-mtb-cup/,
Suportado ng madla: Michelle Dee aminadong bisexual,https://www.abante.com.ph/2023/05/29/suportado-ng-madla-michelle-dee-aminadong-bisexual/,
Isaac Paredes sinindihan Tampa Bay kontra Dodgers,https://www.abante.com.ph/2023/05/29/isaac-paredes-sinindihan-tampa-bay-kontra-dodgers/,
Vice nangabog sa wardrobe: Darren pumiyok sa Binibining Pilipinas,https://www.abante.com.ph/2023/05/29/vice-nangabog-sa-wardrobe-darren-pumiyok-sa-binibining-pilipinas/,
Michael Jan Inigo hari sa Zamboanguita chess,https://www.abante.com.ph/2023/05/29/michael-jan-inigo-hari-sa-zamboanguita-chess/,
Triple Crown 2nd leg aariba,https://www.abante.com.ph/2023/05/29/triple-crown-2nd-leg-aariba/,
Bida ang WUP,https://www.abante.com.ph/2023/05/29/bida-ang-wup/,
Juday bet ipalit kay Charo sa ‘MMK’,https://www.abante.com.ph/2023/05/29/juday-bet-ipalit-kay-charo-sa-mmk/,
"Britney Spears, nanay nagkaayos na",https://www.abante.com.ph/2023/05/29/britney-spears-nanay-nagkaayos-na/,
Chie hinampas ng alon,https://www.abante.com.ph/2023/05/29/chie-hinampas-ng-alon/,
"Ivana namigay ng datung, grocery sa mga ‘di mahadera",https://www.abante.com.ph/2023/05/29/ivana-namigay-ng-datung-grocery-sa-mga-di-mahadera/,
"Richard bibitbitin si Sarah sa Dubai, UK at Madrid",https://www.abante.com.ph/2023/05/29/richard-bibitbitin-si-sarah-sa-dubai-uk-at-madrid/,
Rex kinabog mga kalaban sa ‘The Clash’,https://www.abante.com.ph/2023/05/29/rex-kinabog-mga-kalaban-sa-the-clash/,
Romnick hanga sa pagiging marespeto ng KathNiel,https://www.abante.com.ph/2023/05/29/romnick-hanga-sa-pagiging-marespeto-ng-kathniel/,
"James Reid, Alden Richards bet ‘tikman’ ng seksing TikToker",https://www.abante.com.ph/2023/05/29/james-reid-alden-richards-bet-tikman-ng-seksing-tiktoker/,
"Abante Front Page | Balita ngayong Mayo 29, 2023",https://www.abante.com.ph/2023/05/29/abante-front-page-balita-ngayong-mayo-29-2023/,
"Richard, Ian, Jake umalis na pa-Italy",https://www.abante.com.ph/2023/05/28/richard-ian-jake-umalis-na-pa-italy/,
Potensyal para sa Defense modernization,https://www.abante.com.ph/2023/05/28/potensyal-para-sa-defense-modernization/,
Senador nangamote sa retoke ng panukala,https://www.abante.com.ph/2023/05/28/senador-nangamote-sa-retoke-ng-panukala/,
Ex-Cong Ty hinirit tapyasin excise tax sa petrolyo,https://www.abante.com.ph/2023/05/28/ex-cong-ty-hinirit-tapyasin-excise-tax-sa-petrolyo/,
Maharlika Board susulutin mga proyekto ng Kongreso,https://www.abante.com.ph/2023/05/28/maharlika-board-susulutin-mga-proyekto-ng-kongreso/,
Drug czar demotion kay Digong – Panelo,https://www.abante.com.ph/2023/05/28/drug-czar-demotion-kay-digong-panelo/,
"PBBM pinaporma inter-agency committee Taas-presyo sa pagkain, langis awatin",https://www.abante.com.ph/2023/05/28/pbbm-pinaporma-inter-agency-committee-taas-presyo-sa-pagkain-langis-awatin/,
GMA nilinis si First Lady Liza sa kudeta,https://www.abante.com.ph/2023/05/28/gma-nilinis-si-first-lady-liza-sa-kudeta1/,
Kinasal sa panaginip,https://www.abante.com.ph/2023/05/28/kinasal-sa-panaginip/,
Karangalan at benepisyo,https://www.abante.com.ph/2023/05/28/karangalan-at-benepisyo/,
Caretaker ng beach resort dinedbol sa kubol,https://www.abante.com.ph/2023/05/28/caretaker-ng-beach-resort-dinedbol-sa-kubol/,
1.5K estudyante tinamaan ng sore eyes; F2F class sinuspinde,https://www.abante.com.ph/2023/05/28/1-5k-estudyante-tinamaan-ng-sore-eyes-f2f-class-sinuspinde/,
Abra mayor binawian ng lisensya; 15 baril ipinakukumpiska,https://www.abante.com.ph/2023/05/28/abra-mayor-binawian-ng-lisensya-15-baril-ipinakukumpiska/,
15 Pinoy siklista inararo ng SUV sa Kuwait,https://www.abante.com.ph/2023/05/28/15-pinoy-siklista-inararo-ng-suv-sa-kuwait/,
3 timbog sa P1.4M puslit na pampano,https://www.abante.com.ph/2023/05/28/3-timbog-sa-p1-4m-puslit-na-pampano/,
Melvin Jerusalem isinuko WBO title sa Puerto Rican,https://www.abante.com.ph/2023/05/28/melvin-jerusalem-isinuko-wbo-title-sa-puerto-rican/,
Ban mga sumuway sa rules ng MPBL – Manny Pacquiao,https://www.abante.com.ph/2023/05/28/ban-mga-sumuway-sa-rules-ng-mpbl-manny-pacquiao/,
