Statement,Link,Date
Maymay tinututukan ng boyfriend,https://www.abante.com.ph/2023/05/09/maymay-tinututukan-ng-boyfriend/,
Cong Teves pasaklolo sa Timor-Leste,https://www.abante.com.ph/2023/05/09/cong-teves-pasaklolo-sa-timor-leste/,
Laptop ng mga guro binebenta sa surplus,https://www.abante.com.ph/2023/05/09/laptop-ng-mga-guro-binebenta-sa-surplus1/,
Bully na empleyado sinipa ng senador,https://www.abante.com.ph/2023/05/09/bully-na-empleyado-sinipa-ng-senador1/,
"Abante Front Page | Balita ngayong Mayo 10, 2023",https://www.abante.com.ph/2023/05/09/abante-front-page-balita-ngayong-mayo-10-2023/,
"AbanTV – Showbiz | Chie Filomeno, Jake Cuenca mainit sa sexy photoshoot",https://www.abante.com.ph/2023/05/09/abantv-showbiz-chie-filomeno-jake-cuenca-mainit-sa-sexy-photoshoot/,
"GCash inulan ng reklamo, nawalang pera isosoli",https://www.abante.com.ph/2023/05/09/gcash-inulan-ng-reklamo-nawalang-pera-isosoli/,
Kamara prayoridad 13 panukala sa LEDAC list,https://www.abante.com.ph/2023/05/09/kamara-prayoridad-13-panukala-sa-ledac-list/,
Mandatory insurance sa mga power line worker inaprub,https://www.abante.com.ph/2023/05/09/mandatory-insurance-sa-mga-power-line-worker-inaprub/,
Robin pinag-resign mga staff,https://www.abante.com.ph/2023/05/09/robin-pinag-resign-mga-staff/,
PRA hinarang aplikasyon sa bagong reclamation project,https://www.abante.com.ph/2023/05/09/pra-hinarang-aplikasyon-sa-bagong-reclamation-project/,
PBBM isusulong interes ng ‘Pinas sa ASEAN summit,https://www.abante.com.ph/2023/05/09/pbbm-isusulong-interes-ng-pinas-sa-asean-summit/,
"Programang pangsakahan, prayoridad sa Talavera",https://www.abante.com.ph/2023/05/09/programang-pangsakahan-prayoridad-sa-talavera/,
"Bangka nagka-aberya, 72 nasagip sa trahedya",https://www.abante.com.ph/2023/05/09/bangka-nagka-aberya-72-nasagip-sa-trahedya/,
Higit 400 katao tigok sa baha,https://www.abante.com.ph/2023/05/09/higit-400-katao-tigok-sa-baha/,
"2 sikat na aktres sa Iran, pinatawag ng korte",https://www.abante.com.ph/2023/05/09/2-sikat-na-aktres-sa-iran-pinatawag-ng-korte/,
"Dating food courier, espiya ng NPA sumurender",https://www.abante.com.ph/2023/05/09/dating-food-courier-espiya-ng-npa-sumurender/,
"Vietnamese tiningga sa ulo, katawan drayber sugatan",https://www.abante.com.ph/2023/05/09/vietnamese-tiningga-sa-ulo-katawan-drayber-sugatan/,
"Tanauan, Batangas pinakamainit 30 pang lugar heat index sumirit",https://www.abante.com.ph/2023/05/09/tanauan-batangas-pinakamainit-30-pang-lugar-heat-index-sumirit/,
Tsongki sa wallet nabisto estudyante arestado,https://www.abante.com.ph/2023/05/09/tsongki-sa-wallet-nabisto-estudyante-arestado/,
Barangay chairman todas sa ambush,https://www.abante.com.ph/2023/05/09/barangay-chairman-todas-sa-ambush/,
3K pasaway na pulis namumurong masibak,https://www.abante.com.ph/2023/05/09/3k-pasaway-na-pulis-namumurong-masibak/,
Umutas sa ermat nalambat,https://www.abante.com.ph/2023/05/09/umutas-sa-ermat-nalambat/,
Kaya super proud si Belle… Donny namigay ng mga sapatos,https://www.abante.com.ph/2023/05/09/kaya-super-proud-si-belle-donny-namigay-ng-mga-sapatos/,
Pinay lifter Vanessa Sarno 3 pilak sa Asian Championship,https://www.abante.com.ph/2023/05/09/pinay-lifter-vanessa-sarno-3-pilak-sa-asian-championship/,
EJ Obiena ‘pinersonal’ mga ginto sa SEA Games,https://www.abante.com.ph/2023/05/09/ej-obiena-pinersonal-mga-ginto-sa-sea-games/,
"Jackie, Ricky ‘di totally friends",https://www.abante.com.ph/2023/05/09/jackie-ricky-di-totally-friends/,
Women’s badminton selyado podium finish,https://www.abante.com.ph/2023/05/09/womens-badminton-selyado-podium-finish/,
"Huwag na kayo uulit! Ato Ular, Rey Suerte, Kent Salado multa ng tig-P50K sa ‘ligang labas’",https://www.abante.com.ph/2023/05/09/huwag-na-kayo-uulit-ato-ular-rey-suerte-kent-salado-multa-ng-tig-p50k-sa-ligang-labas/,
"Xian truly, madly, deeply in love kay Kim",https://www.abante.com.ph/2023/05/09/xian-truly-madly-deeply-in-love-kay-kim/,
Vic Sotto mas kumportable sa GMA-7,https://www.abante.com.ph/2023/05/09/vic-sotto-mas-kumportable-sa-gma-7/,
CEU dinurog AMA Online,https://www.abante.com.ph/2023/05/09/ceu-dinurog-ama-online/,
Bulinggit na matinik! Caloy Yulo kinana 2nd gold sa SEAG,https://www.abante.com.ph/2023/05/09/bulinggit-na-matinik-caloy-yulo-kinana-2nd-gold-sa-seag/,
"Justin Brownlee, Gilas ‘minasaker’ Malaysia",https://www.abante.com.ph/2023/05/09/justin-brownlee-gilas-minasaker-malaysia/,
Keber sa masakit na paa! Sheena Toring kakana sa Game 2 kontra DLSU,https://www.abante.com.ph/2023/05/09/keber-sa-masakit-na-paa-sheena-toring-kakana-sa-game-2-kontra-dlsu/,
"Goodbye Ateneo, hello Akari! Faith Nisperos papalo sa PVL",https://www.abante.com.ph/2023/05/09/goodbye-ateneo-hello-akari-faith-nisperos-papalo-sa-pvl/,
"Rangers nag-rally, pinataob Mariners",https://www.abante.com.ph/2023/05/09/rangers-nag-rally-pinataob-mariners/,
Manny Pacquiao hindi pababayaan boksingerong na-coma sa Blow-by-Blow,https://www.abante.com.ph/2023/05/09/manny-pacquiao-hindi-pababayaan-boksingerong-na-coma-sa-blow-by-blow/,
"Grand Monarch, Earli Boating aarangkada",https://www.abante.com.ph/2023/05/09/grand-monarch-earli-boating-aarangkada/,
Sunshine puno ng hugot,https://www.abante.com.ph/2023/05/09/sunshine-puno-ng-hugot/,
Lonnie Walker secret weapon ng LA Lakers,https://www.abante.com.ph/2023/05/09/lonnie-walker-secret-weapon-ng-la-lakers/,
Sana all! Doggy lumipad sa ere kasama amo,https://www.abante.com.ph/2023/05/09/sana-all-doggy-lumipad-sa-ere-kasama-amo/,
Jimmy Butler nambarako! Miami Heat kumatok sa East championship,https://www.abante.com.ph/2023/05/09/jimmy-butler-nambarako-miami-heat-kumatok-sa-east-championship/,
Andrea ginising ang pagnanasa ng mga kalalakihan,https://www.abante.com.ph/2023/05/09/andrea-ginising-ang-pagnanasa-ng-mga-kalalakihan/,
Liza kinabog ni Patrick Starr,https://www.abante.com.ph/2023/05/09/liza-kinabog-ni-patrick-starr/,
Nalimas sa account: Pera ni Chad Kinis naibalik ng Gcash,https://www.abante.com.ph/2023/05/09/nalimas-sa-account-pera-ni-chad-kinis-naibalik-ng-gcash/,
4 coast guard graduate sabay-sabay nag-propose sa dyowa,https://www.abante.com.ph/2023/05/09/4-coast-guard-graduate-sabay-sabay-nag-propose-sa-dyowa/,
Vice tinapon mga butas na brief ni Ion,https://www.abante.com.ph/2023/05/09/vice-tinapon-mga-butas-na-brief-ni-ion/,
Judiciary Magis martsa sa 9th UNTV Cup finals,https://www.abante.com.ph/2023/05/09/judiciary-magis-martsa-sa-9th-untv-cup-finals/,
Pila sa Purgatoryo Nakita sa Astral Travel!,https://www.abante.com.ph/2023/05/09/pila-sa-purgatoryo-nakita-sa-astral-travel/,
Bundok Apo isang biyaya,https://www.abante.com.ph/2023/05/09/bundok-apo-isang-biyaya/,
Mga lolo viral sa aliw na volleyball game,https://www.abante.com.ph/2023/05/09/mga-lolo-viral-sa-aliw-na-volleyball-game/,
Taga-CamSur topnotcher sa Criminology licensure,https://www.abante.com.ph/2023/05/09/taga-camsur-topnotcher-sa-criminology-licensure/,
"Pinatamaan si Lianne Valentin? Carmina, Zoren ‘di hiwalay",https://www.abante.com.ph/2023/05/09/pinatamaan-si-lianne-valentin-carmina-zoren-di-hiwalay/,
"Angeline, Klarisse nakakatawa kapalpakan sa ‘ASAP’",https://www.abante.com.ph/2023/05/09/angeline-klarisse-nakakatawa-kapalpakan-sa-asap/,
Jose never naging isyu pera kay Bossing Vic,https://www.abante.com.ph/2023/05/09/jose-never-naging-isyu-pera-kay-bossing-vic/,
Anong meron sa Marikina?,https://www.abante.com.ph/2023/05/09/anong-meron-sa-marikina/,
"Buslo, ‘di puro PUSO!",https://www.abante.com.ph/2023/05/09/buslo-di-puro-puso/,
Gawing ‘viral’ ang maayos na pamamahala,https://www.abante.com.ph/2023/05/09/gawing-viral-ang-maayos-na-pamamahala/,
"Abante Front Page | Balita ngayong Mayo 9, 2023",https://www.abante.com.ph/2023/05/08/abante-front-page-balita-ngayong-mayo-9-2023/,
"AbanTV – News | P8M alahas tinangay sa jewelry shop! Tindera, holdaper magka-live in pala",https://www.abante.com.ph/2023/05/08/abantv-news-p8m-alahas-tinangay-sa-jewelry-shop-tindera-holdaper-magka-live-in-pala/,
Mga karatig-lugar damay! NCR sapol ng brownout,https://www.abante.com.ph/2023/05/08/mga-karatig-lugar-damay-ncr-sapol-ng-brownout/,
Eksperto nirekomenda pagsusuot ng face mask,https://www.abante.com.ph/2023/05/08/eksperto-nirekomenda-pagsusuot-ng-face-mask/,
Kababaihan pinayuhang magpasuri vs cervical cancer,https://www.abante.com.ph/2023/05/08/kababaihan-pinayuhang-magpasuri-vs-cervical-cancer/,
"2 general, 2 colonel na dawit sa droga tinanggal benepisyo",https://www.abante.com.ph/2023/05/08/2-general-2-colonel-na-dawit-sa-droga-tinanggal-benepisyo/,
Mga Pinoy na walang trabaho nabawasan,https://www.abante.com.ph/2023/05/08/mga-pinoy-na-walang-trabaho-nabawasan-2/,
"DA Usec no show sa Senado, sugar probe nabulilyaso",https://www.abante.com.ph/2023/05/08/da-usec-no-show-sa-senado-sugar-probe-nabulilyaso/,
10M pamilya kulang sa tsibog,https://www.abante.com.ph/2023/05/08/10m-pamilya-kulang-sa-tsibog/,
Imelda kinumusta ni King Charles,https://www.abante.com.ph/2023/05/08/imelda-kinumusta-ni-king-charles/,
FDA nagbabala sa publiko: Pekeng branded na gamot nagkalat,https://www.abante.com.ph/2023/05/08/fda-nagbabala-sa-publiko-pekeng-branded-na-gamot-nagkalat/,
"Shabu, Ecstasy sapaw sa amats ng cocktail drug – PDEA",https://www.abante.com.ph/2023/05/08/shabu-ecstasy-sapaw-sa-amats-ng-cocktail-drug-pdea1/,
Minahan sa Peru nasunog 27 minero tigok,https://www.abante.com.ph/2023/05/08/minahan-sa-peru-nasunog-27-minero-tigok/,
Biden hinirit sa US Congress higpitan pag-aari ng armas,https://www.abante.com.ph/2023/05/08/biden-hinirit-sa-us-congress-higpitan-pag-aari-ng-armas/,
"6k tourist cop ikakalat sa Palawan, Boracay, Siargao",https://www.abante.com.ph/2023/05/08/6k-tourist-cop-ikakalat-sa-palawan-boracay-siargao/,
2 Indonesian tiklo; P600K yosi pinuslit sa Saranggani,https://www.abante.com.ph/2023/05/08/2-indonesian-tiklo-p600k-yosi-pinuslit-sa-saranggani/,
"Nang-agaw ng esmi, tinarakan sa birthday party",https://www.abante.com.ph/2023/05/08/nang-agaw-ng-esmi-tinarakan-sa-birthday-party/,
"Angkas na misis todas, mister sugatan sa salpok ng truck",https://www.abante.com.ph/2023/05/08/angkas-na-misis-todas-mister-sugatan-sa-salpok-ng-truck/,
Selosong lover ginilitan natutulog na partner,https://www.abante.com.ph/2023/05/08/selosong-lover-ginilitan-natutulog-na-partner/,
7 Malaysian timbog; 43 POGO worker nasagip,https://www.abante.com.ph/2023/05/08/7-malaysian-timbog-43-pogo-worker-nasagip/,
Ikalawang sigwada ng PNP balasahan umarangkada,https://www.abante.com.ph/2023/05/08/ikalawang-sigwada-ng-pnp-balasahan-umarangkada/,
Caloy Yulo sapol ginto sa individual all-around,https://www.abante.com.ph/2023/05/08/caloy-yulo-sapol-ginto-sa-individual-all-around/,
"Like father, like daughter! Jamie Lim tinapatan 2 ginto ni Samboy Lim",https://www.abante.com.ph/2023/05/08/like-father-like-daughter-jamie-lim-tinapatan-2-ginto-ni-samboy-lim/,
Philippine Madrigal Singers nagpasiklab sa US,https://www.abante.com.ph/2023/05/08/philippine-madrigal-singers-nagpasiklab-sa-us/,
Look-alike yarn? Braso inihilera sa pata ng baboy,https://www.abante.com.ph/2023/05/08/look-alike-yarn-braso-inihilera-sa-pata-ng-baboy/,
"Lola na nagtitimpla ng gin, viral",https://www.abante.com.ph/2023/05/08/lola-na-nagtitimpla-ng-gin-viral/,
Holy distraction? Sto. Niño ‘naglalakad’ sa zoom meeting,https://www.abante.com.ph/2023/05/08/holy-distraction-sto-nino-naglalakad-sa-zoom-meeting/,
Utang ng ‘Eat Bulaga’? Bayad na… na-media kasi! – Vic Sotto,https://www.abante.com.ph/2023/05/08/utang-ng-eat-bulaga-bayad-na-na-media-kasi-vic-sotto1/,
"Irapan nina Angel Canino, Bella Belen walang personalan",https://www.abante.com.ph/2023/05/08/irapan-nina-angel-canino-bella-belen-walang-personalan/,
Pau Fajardo nakikipag-date na sa young politician,https://www.abante.com.ph/2023/05/08/pau-fajardo-nakikipag-date-na-sa-young-politician/,
"Richard, Sarah nakabuo ng baby sa Palawan?",https://www.abante.com.ph/2023/05/08/richard-sarah-nakabuo-ng-baby-sa-palawan/,
Albay artist nakapagpatayo ng bahay galing sa  patapong metal,https://www.abante.com.ph/2023/05/08/albay-artist-nakapagpatayo-ng-bahay-galing-sa-patapong-metal/,
Coach Yeng Guiao dehins maintindihan mga player na naglalaro sa ligang labas,https://www.abante.com.ph/2023/05/08/coach-yeng-guiao-dehins-maintindihan-mga-player-na-naglalaro-sa-ligang-labas/,
PSL: Mandaluyong pinaluhod New Era,https://www.abante.com.ph/2023/05/08/psl-mandaluyong-pinaluhod-new-era/,
Ria super smile lang kahit naiinitan,https://www.abante.com.ph/2023/05/08/ria-super-smile-lang-kahit-naiinitan/,
Liza standout sa ‘Gold Gala’ Los Angeles,https://www.abante.com.ph/2023/05/08/liza-standout-sa-gold-gala-los-angeles/,
Regine pinush galing ni Janella,https://www.abante.com.ph/2023/05/08/regine-pinush-galing-ni-janella/,
Walang kaartehan… Pia walang glam team sa kasal,https://www.abante.com.ph/2023/05/08/walang-kaartehan-pia-walang-glam-team-sa-kasal/,
Maxene ipinaalala ang kahalagahan ng mental health awareness,https://www.abante.com.ph/2023/05/08/maxene-ipinaalala-ang-kahalagahan-ng-mental-health-awareness/,
"Zia mana kina Marian, Dingdong sa galing magsayaw",https://www.abante.com.ph/2023/05/08/zia-mana-kina-marian-dingdong-sa-galing-magsayaw/,
"Kevin Durant, Devin Booker itinabla Phoenix sa Denver",https://www.abante.com.ph/2023/05/08/kevin-durant-devin-booker-itinabla-phoenix-sa-denver/,
Aminin na kasi! Janine ‘di maitago pagmamahalan nila ni Paulo,https://www.abante.com.ph/2023/05/08/aminin-na-kasi-janine-di-maitago-pagmamahalan-nila-ni-paulo/,
Estudyanteng walang braso hakot ginto sa swimming competition,https://www.abante.com.ph/2023/05/08/estudyanteng-walang-braso-hakot-ginto-sa-swimming-competition/,
International Master Roderick Nava ikakasa 9th edition Kamatyas Chess,https://www.abante.com.ph/2023/05/08/international-master-roderick-nava-ikakasa-9th-edition-kamatyas-chess/,
Daniella Uy sasakupin ika-2 korona sa ICTSI Luisita,https://www.abante.com.ph/2023/05/08/daniella-uy-sasakupin-ika-2-korona-sa-ictsi-luisita/,
OFW food vlogger wagi sa UAE superstar award,https://www.abante.com.ph/2023/05/08/ofw-food-vlogger-wagi-sa-uae-superstar-award/,
Sey mo Khalil? Joshua nakakakilig paghimas kay Gabbi,https://www.abante.com.ph/2023/05/08/sey-mo-khalil-joshua-nakakakilig-paghimas-kay-gabbi/,
PLDT ace Mika Reyes inoperahan sa balikat,https://www.abante.com.ph/2023/05/08/pldt-ace-mika-reyes-inoperahan-sa-balikat/,
Fernando Casares nadepensahan titulo,https://www.abante.com.ph/2023/05/08/fernando-casares-nadepensahan-titulo/,
Kahit nanay na Rita makakapareha uli si Ken,https://www.abante.com.ph/2023/05/08/kahit-nanay-na-rita-makakapareha-uli-si-ken/,
Tres ni James Harden iniligtas Sixers sa Game 4 kontra Celtics,https://www.abante.com.ph/2023/05/08/tres-ni-james-harden-iniligtas-sixers-sa-game-4-kontra-celtics/,
"Sarina Bolden, Filipinas bawal kumurap kontra Vietnam",https://www.abante.com.ph/2023/05/08/sarina-bolden-filipinas-bawal-kumurap-kontra-vietnam/,
"Mookie Betts, LA Dodgers sinagasaan San Diego Padres",https://www.abante.com.ph/2023/05/08/mookie-betts-la-dodgers-sinagasaan-san-diego-padres/,
Blackburn pinasaya mga liyamadista,https://www.abante.com.ph/2023/05/08/blackburn-pinasaya-mga-liyamadista/,
32nd Cambodia SEAG; PSC patuloy ayuda sa national squad,https://www.abante.com.ph/2023/05/08/32nd-cambodia-seag-psc-patuloy-ayuda-sa-national-squad/,
Maxine mataray na mabait,https://www.abante.com.ph/2023/05/08/maxine-mataray-na-mabait/,
Kahit ikasal kay Zanjoe Ria walang balak layasan ang showbiz,https://www.abante.com.ph/2023/05/08/kahit-ikasal-kay-zanjoe-ria-walang-balak-layasan-ang-showbiz/,
Jodi kinilabutan nang sumugod sa GMA-7,https://www.abante.com.ph/2023/05/08/jodi-kinilabutan-nang-sumugod-sa-gma-7/,
Nagbebenta kasi ng sasakyan Darryl Yap inintrigang naghihirap,https://www.abante.com.ph/2023/05/08/nagbebenta-kasi-ng-sasakyan-darryl-yap-inintrigang-naghihirap/,
Megan ‘di na takot mag-taping,https://www.abante.com.ph/2023/05/08/megan-di-na-takot-mag-taping1/,
RLC Gears up as Partner for Bacolod Super City,https://www.abante.com.ph/2023/05/08/rlc-gears-up-as-partner-for-bacolod-super-city/,
Robinsons Homes Unveils Newest Residential Development in Bulacan,https://www.abante.com.ph/2023/05/08/robinsons-homes-unveils-newest-residential-development-in-bulacan/,
"Abante Front Page | Balita ngayong Mayo 8, 2023",https://www.abante.com.ph/2023/05/08/abante-front-page-balita-ngayong-mayo-8-2023/,
"AbanTV – News | Viral: ‘Family Mart’ stores sa Metro Manila sarado na, Dennis Uy nasisi!",https://www.abante.com.ph/2023/05/07/abantv-news-viral-family-mart-stores-sa-metro-manila-sarado-na-dennis-uy-nasisi/,
May masasabon pagbalik ni PBBM: Mga ‘bata’ ni Bautista sa NAIA sisipain,https://www.abante.com.ph/2023/05/07/may-masasabon-pagbalik-ni-pbbm-mga-bata-ni-bautista-sa-naia-sisipain/,
Malaking balakid sa pag-arangkada ng electric motorcycles,https://www.abante.com.ph/2023/05/07/malaking-balakid-sa-pag-arangkada-ng-electric-motorcycles/,
Daghang salamat,https://www.abante.com.ph/2023/05/07/daghang-salamat-2/,
Magandang kinabukasan para sa kasambahay,https://www.abante.com.ph/2023/05/07/magandang-kinabukasan-para-sa-kasambahay/,
Pautang sa maliliit na negosyo nabawasan,https://www.abante.com.ph/2023/05/07/pautang-sa-maliliit-na-negosyo-nabawasan/,
"Isuzu pina-recall higit 2K ng mu-X, DMAX",https://www.abante.com.ph/2023/05/07/isuzu-pina-recall-higit-2k-ng-mu-x-dmax/,
Politiko may sikretong walwalan sa resto,https://www.abante.com.ph/2023/05/07/politiko-may-sikretong-walwalan-sa-resto/,
Malacañang inanunsiyo mga bagong appointee ni Marcos,https://www.abante.com.ph/2023/05/07/malacanang-inanunsiyo-mga-bagong-appointee-ni-marcos/,
Malalim na relasyon PH-UK wish ni Romualdez,https://www.abante.com.ph/2023/05/07/malalim-na-relasyon-ph-uk-wish-ni-romualdez/,
Ibasura! Mga consumer sapol ng dagdag-buwis sa online seller,https://www.abante.com.ph/2023/05/07/ibasura-mga-consumer-sapol-ng-dagdag-buwis-sa-online-seller/,
"Chiz: Presyo ng COVID bakuna, hubaran na",https://www.abante.com.ph/2023/05/07/chiz-presyo-ng-covid-bakuna-hubaran-na/,
BBM pinatutukan pangakong P72B investment mula sa US,https://www.abante.com.ph/2023/05/07/bbm-pinatutukan-pangakong-p72b-investment-mula-sa-us/,
Fertilizer scam sa DA binuking,https://www.abante.com.ph/2023/05/07/fertilizer-scam-sa-da-binuking/,
"Mga maliliit na negosyate, bumida sa Nueva Ecija",https://www.abante.com.ph/2023/05/07/mga-maliliit-na-negosyate-bumida-sa-nueva-ecija/,
"Kaso ng rabies sa Region 1, sumisirit",https://www.abante.com.ph/2023/05/07/kaso-ng-rabies-sa-region-1-sumisirit/,
"Pamamaril sa Texas mall; gunman, 8 pa todas, 7 sugatan",https://www.abante.com.ph/2023/05/07/pamamaril-sa-texas-mall-gunman-8-pa-todas-7-sugatan/,
"COVID-19 global health emergency, winakasan na ng WHO",https://www.abante.com.ph/2023/05/07/covid-19-global-health-emergency-winakasan-na-ng-who/,
Mag-dyowa nirapido habang natutulog,https://www.abante.com.ph/2023/05/07/mag-dyowa-nirapido-habang-natutulog/,
"Caloocan, Valenzuela, QC 1 week diyeta sa tubig",https://www.abante.com.ph/2023/05/07/caloocan-valenzuela-qc-1-week-diyeta-sa-tubig/,
23 pulis sibak sa iligal na droga,https://www.abante.com.ph/2023/05/07/23-pulis-sibak-sa-iligal-na-droga/,
Malta hot spot sa human trafficking,https://www.abante.com.ph/2023/05/07/malta-hot-spot-sa-human-trafficking/,
Obstacle Course squad nagdagdag ng 2 ginto,https://www.abante.com.ph/2023/05/07/obstacle-course-squad-nagdagdag-ng-2-ginto/,
Boksingero sa ‘Blow By Blow’ namemeligro buhay nang ma-coma,https://www.abante.com.ph/2023/05/07/boksingero-sa-blow-by-blow-namemeligro-buhay-nang-ma-coma/,
PPA 83% ng badyet nagastos sa mga proyekto noong 2022,https://www.abante.com.ph/2023/05/07/ppa-83-ng-badyet-nagastos-sa-mga-proyekto-noong-2022/,
Speaker Romualdez: PBBM maraming na-accomplished sa US visit,https://www.abante.com.ph/2023/05/07/speaker-romualdez-pbbm-maraming-na-accomplished-sa-us-visit/,
ACT-CIS sisilipin hinaing ng mga mangingisda sa Manila Bay,https://www.abante.com.ph/2023/05/07/act-cis-sisilipin-hinaing-ng-mga-mangingisda-sa-manila-bay/,
Bilang paghahanda sa kasal… Maine nagbabawas na ng trabaho,https://www.abante.com.ph/2023/05/07/bilang-paghahanda-sa-kasal-maine-nagbabawas-na-ng-trabaho/,
Dabarkads kinanta theme song ng ‘It’s Showtime’,https://www.abante.com.ph/2023/05/07/dabarkads-kinanta-theme-song-ng-its-showtime/,
KD nag-init sa mga sexy photo ni Alexa,https://www.abante.com.ph/2023/05/07/kd-nag-init-sa-mga-sexy-photo-ni-alexa/,
Gary ‘di malimutan double bypass surgery,https://www.abante.com.ph/2023/05/07/gary-di-malimutan-double-bypass-surgery/,
"Eugene, Dolly magsasama sa stage play",https://www.abante.com.ph/2023/05/07/eugene-dolly-magsasama-sa-stage-play/,
3 aso chill sa pagiging angkas ng rider,https://www.abante.com.ph/2023/05/07/3-aso-chill-sa-pagiging-angkas-ng-rider/,
"Doctor, nurse sinayawan mamshie na manganganak",https://www.abante.com.ph/2023/05/07/doctor-nurse-sinayawan-mamshie-na-manganganak/,
"Iloilo artist gulay, bulaklak ang gamit pang-design",https://www.abante.com.ph/2023/05/07/iloilo-artist-gulay-bulaklak-ang-gamit-pang-design/,
Housekeeper noon panalo sa bulaklak negosyo,https://www.abante.com.ph/2023/05/07/housekeeper-noon-panalo-sa-bulaklak-negosyo/,
Pinoy resto bumida sa Italy magazine,https://www.abante.com.ph/2023/05/07/pinoy-resto-bumida-sa-italy-magazine/,
Caloy Yulo target 4 gold sa SEAG gymnastics event,https://www.abante.com.ph/2023/05/07/caloy-yulo-target-4-gold-sa-seag-gymnastics-event/,
Ekstensyon ng SIM registration ‘wag sayangin,https://www.abante.com.ph/2023/05/07/ekstensyon-ng-sim-registration-wag-sayangin/,
"Nasa alapaap! Scottie, Jinky Thompson winelcome unang supling",https://www.abante.com.ph/2023/05/07/nasa-alapaap-scottie-jinky-thompson-winelcome-unang-supling/,
Mas maraming STEM classes hinihikayat para punan kakulangan sa civil engineers,https://www.abante.com.ph/2023/05/07/mas-maraming-stem-classes-hinihikayat-para-punan-kakulangan-sa-civil-engineers/,
Kim Mangrobang naidepensa korona sa SEA Games duathlon,https://www.abante.com.ph/2023/05/07/kim-mangrobang-naidepensa-korona-sa-sea-games-duathlon/,
Kinalampag ng mga Multo sa Hotel,https://www.abante.com.ph/2023/05/07/kinalampag-ng-mga-multo-sa-hotel/,
Pinay racer Bianca Bustamante nagwagi sa Valencia F1 Academy,https://www.abante.com.ph/2023/05/07/pinay-racer-bianca-bustamante-nagwagi-sa-valencia-f1-academy/,
"Miami angat sa serye, 2-1! Jimmy Butler nagbalik mula sa ankle sprain",https://www.abante.com.ph/2023/05/07/miami-angat-sa-serye-2-1-jimmy-butler-nagbalik-mula-sa-ankle-sprain/,
PBA may balasahan sa mga patakaran,https://www.abante.com.ph/2023/05/07/pba-may-balasahan-sa-mga-patakaran/,
Cebu Pacific sakalam sa MIAA,https://www.abante.com.ph/2023/05/07/cebu-pacific-sakalam-sa-miaa/,
Pinoy tanker Jerard Jacinto binasag sariling national 100m back record,https://www.abante.com.ph/2023/05/07/pinoy-tanker-jerard-jacinto-binasag-sariling-national-100m-back-record/,
Pinay bet Junna Tsukii dehins matanggap desisyon ng referee,https://www.abante.com.ph/2023/05/07/pinay-bet-junna-tsukii-dehins-matanggap-desisyon-ng-referee/,
Harrison Bader inangklahan Yankees kontra Tampa Bay,https://www.abante.com.ph/2023/05/07/harrison-bader-inangklahan-yankees-kontra-tampa-bay/,
JC nag-military training,https://www.abante.com.ph/2023/05/07/jc-nag-military-training/,
Dion nahilo… Elijah hinimatay sa motorcade,https://www.abante.com.ph/2023/05/07/dion-nahilo-elijah-hinimatay-sa-motorcade/,
Maricel sasampalin nanloko kay Edu,https://www.abante.com.ph/2023/05/07/maricel-sasampalin-nanloko-kay-edu/,
Kim nabitin kay JM,https://www.abante.com.ph/2023/05/07/kim-nabitin-kay-jm/,
"Heart, John Lloyd sumuporta Bea angat ang husay sa musical",https://www.abante.com.ph/2023/05/07/heart-john-lloyd-sumuporta-bea-angat-ang-husay-sa-musical/,
Reunion ng ex-couple ‘di tuloy?,https://www.abante.com.ph/2023/05/07/reunion-ng-ex-couple-di-tuloy/,
"Vic, Jose, Maja pipigahin sa tunay na estado ng ‘Eat Bulaga’",https://www.abante.com.ph/2023/05/07/vic-jose-maja-pipigahin-sa-tunay-na-estado-ng-eat-bulaga/,
"LeBron James nagpahiyang, dehins tumira sa unang quarter",https://www.abante.com.ph/2023/05/07/lebron-james-nagpahiyang-dehins-tumira-sa-unang-quarter/,
Kim Yutangco Zafra pumalag sa Estonia,https://www.abante.com.ph/2023/05/07/kim-yutangco-zafra-pumalag-sa-estonia/,
Secret Service angat sa 3YO,https://www.abante.com.ph/2023/05/07/secret-service-angat-sa-3yo/,
8th Kamatyas Chess aariba sa Las Piñas,https://www.abante.com.ph/2023/05/07/8th-kamatyas-chess-aariba-sa-las-pinas/,
"Presyo ng ticket sa mga concert nina Bruno, Sarah nakakawindang",https://www.abante.com.ph/2023/05/07/presyo-ng-ticket-sa-mga-concert-nina-bruno-sarah-nakakawindang/,
‘TNT’ grand Champion Lyka mapasikat kaya ng ‘It’s Showtime’?,https://www.abante.com.ph/2023/05/07/tnt-grand-champion-lyka-mapasikat-kaya-ng-its-showtime/,
"Abante Front Page | Balita ngayong Mayo 7, 2023",https://www.abante.com.ph/2023/05/07/abante-front-page-balita-ngayong-mayo-7-2023/,
"AbanTV – Showbiz | Aktor, bading na talent manager laging sabay mag-shower",https://www.abante.com.ph/2023/05/06/abantv-showbiz-aktor-bading-na-talent-manager-laging-sabay-mag-shower/,
Nueva Ecija nagluksa sa pagpanaw ni Mayor Dizon,https://www.abante.com.ph/2023/05/06/nueva-ecija-nagluksa-sa-pagpanaw-ni-mayor-dizon/,
"Dating galamay ng CPP-NPA, sumuko",https://www.abante.com.ph/2023/05/06/dating-galamay-ng-cpp-npa-sumuko/,
"Pulis tinakasan ng bebot na preso, sibak",https://www.abante.com.ph/2023/05/06/pulis-tinakasan-ng-bebot-na-preso-sibak/,
Trak sumalpok! 25 estudyante nadale,https://www.abante.com.ph/2023/05/06/trak-sumalpok-25-estudyante-nadale/,
Walang balasahan sa Senado,https://www.abante.com.ph/2023/05/06/walang-balasahan-sa-senado/,
